[
  {
    "id": "aon-hazards--5-anti-gravity-pulse",
    "name": "Anti-Gravity Pulse",
    "level": 0,
    "complexity": "complex",
    "type": "trap",
    "traits": [
      "Tech",
      "Trap"
    ],
    "source": "GM Core",
    "description": "A harmful pulse of anti-gravity is activated by a sensor that detects motion within 30 feet.",
    "stealth": "13",
    "stealthDC": 13,
    "disable": "DC 18 Computers (trained) to jam the motion detector's signal or DC 16 Thievery (trained) to deactivate the motion detector",
    "reset": "The trap resets after 15 minutes.",
    "saves": {},
    "actions": [
      {
        "name": "Gravity Pulse",
        "actionType": "reaction",
        "effect": "(force)**Trigger** A creature enters the sensor's detection area; **Effect** The trap releases a gravity pulse, dealing 2d6+3 force damage to the triggering creature (DC 15 basic Reflex save). The area within 30 feet of the sensor then becomes zero gravity for 1 minute."
      }
    ],
    "rawText": " Anti-Gravity Pulse Source GM Core pg. 104 Complexity Complex A harmful pulse of anti-gravity is activated by a sensor that detects motion within 30 feet. --- Stealth 13 Disable DC 18 Computers (trained) to jam the motion detector's signal or DC 16 Thievery (trained) to deactivate the motion detector Gravity Pulse Reaction (force) Trigger A creature enters the sensor's detection area; Effect The trap releases a gravity pulse, dealing 2d6+3 force damage to the triggering creature (DC 15 basic Reflex save). The area within 30 feet of the sensor then becomes zero gravity for 1 minute. --- Reset The trap resets after 15 minutes."
  },
  {
    "id": "aon-hazards--6-caustic-nectar-spray",
    "name": "Caustic Nectar Spray",
    "level": 0,
    "complexity": "complex",
    "type": "environmental",
    "traits": [
      "Environmental"
    ],
    "source": "GM Core",
    "description": "An alien flower sprays a stream of caustic nectar.",
    "stealth": "16",
    "stealthDC": 16,
    "disable": "DC 13 Nature (trained) to lull the flower into a passive state, or DC 13 Survival (trained) to mislead the flower's senses; DC 16 Acrobatics to move by the flower without triggering it (this doesn't disable the trap)",
    "reset": "The flower's nectar reserve is refilled after 1 hour.",
    "ac": 16,
    "saves": {
      "fortitude": 9,
      "reflex": 3
    },
    "hp": 20,
    "immunities": [
      "acid",
      "mental"
    ],
    "actions": [
      {
        "name": "Nectar Spray",
        "actionType": "reaction",
        "trigger": "A creature comes within 15 feet of the flower",
        "effect": "The flower makes a nectar Strike against the triggering creature."
      }
    ],
    "rawText": " Caustic Nectar Spray Source GM Core pg. 105 Complexity Complex An alien flower sprays a stream of caustic nectar. --- Stealth 16 Disable DC 13 Nature (trained) to lull the flower into a passive state, or DC 13 Survival (trained) to mislead the flower's senses; DC 16 Acrobatics to move by the flower without triggering it (this doesn't disable the trap) AC 16, Fort +9, Ref +3 HP 20 Immunities acid, mental Nectar Spray Reaction Trigger A creature comes within 15 feet of the flower; Effect The flower makes a nectar Strike against the triggering creature. Ranged nectar +11 (acid, range increment 15 feet), Damage 2d6+3 acid --- Reset The flower's nectar reserve is refilled after 1 hour."
  },
  {
    "id": "aon-hazards--17-phantom-communication",
    "name": "Phantom Communication",
    "level": 0,
    "complexity": "complex",
    "type": "haunt",
    "traits": [
      "Haunt"
    ],
    "source": "GM Core",
    "description": "Angry spirits utter haunting threats and condemnations through a nearby comm unit.",
    "stealth": "DC 16 (trained) to notice strange static",
    "stealthDC": 16,
    "disable": "DC 15 Religion (trained) to banish the spirits, or DC 18 Performance to drown out the spirits' voices, or DC 16 Computers (trained) to disperse the ghostly signal",
    "saves": {},
    "actions": [
      {
        "name": "Threatening Message",
        "actionType": "reaction",
        "effect": "(auditory, emotion, fear, mental) **Trigger** A creature with a comm unit enters the haunt's area; **Effect** The haunt utters threats through the triggering comm unit, dealing 1d6+4 mental damage to creatures within 20 feet of the comm unit (DC 19 basic Will save). On a failure, the creature is also frightened 1."
      }
    ],
    "rawText": " Phantom Communication Source GM Core pg. 107 Complexity Complex Angry spirits utter haunting threats and condemnations through a nearby comm unit. --- Stealth DC 16 (trained) to notice strange static Disable DC 15 Religion (trained) to banish the spirits, or DC 18 Performance to drown out the spirits' voices, or DC 16 Computers (trained) to disperse the ghostly signal Threatening Message Reaction (auditory, emotion, fear, mental) Trigger A creature with a comm unit enters the haunt's area; Effect The haunt utters threats through the triggering comm unit, dealing 1d6+4 mental damage to creatures within 20 feet of the comm unit (DC 19 basic Will save). On a failure, the creature is also frightened 1."
  },
  {
    "id": "aon-hazards--42-scrap-warren",
    "name": "Scrap Warren",
    "level": 0,
    "complexity": "complex",
    "type": "trap",
    "traits": [
      "Mechanical",
      "Trap"
    ],
    "source": "Guilt of the Grave World",
    "description": "A large 5-foot-high pile of junk towers above the ground with holes in it big enough for only rats to squeeze through.",
    "stealth": "DC 15",
    "stealthDC": 15,
    "disable": "DC 12 Thievery to stabilize the junk pile, DC 14 Survival to collapse it down on itself, or DC 16 Athletics to smash through it without setting it of",
    "reset": "This trap must be manually reset.",
    "ac": 10,
    "saves": {
      "fortitude": 3,
      "reflex": 1
    },
    "hardness": 3,
    "hp": 12,
    "bt": 6,
    "immunities": [
      "critical hits",
      "object immunities",
      "precision damage"
    ],
    "actions": [
      {
        "name": "Spiky Collapse",
        "actionType": "reaction",
        "trigger": "A creature other than a scrap rat enters the area of the junk warren",
        "effect": "The warren collapses in on the creature, making a melee strike with an attack modifier of +5. If the trap was undetected, the creature is off-guard against this attack."
      }
    ],
    "rawText": " Scrap Warren Source Guilt of the Grave World pg. 25 Complexity Complex A large 5-foot-high pile of junk towers above the ground with holes in it big enough for only rats to squeeze through. --- Stealth DC 15 Disable DC 12 Thievery to stabilize the junk pile, DC 14 Survival to collapse it down on itself, or DC 16 Athletics to smash through it without setting it of AC 10, Fort +3, Ref +1 Hardness 3 HP 12 (BT 6) Immunities critical hits, object immunities, precision damage Spiky Collapse Reaction Trigger A creature other than a scrap rat enters the area of the junk warren; Effect The warren collapses in on the creature, making a melee strike with an attack modifier of +5. If the trap was undetected, the creature is off-guard against this attack. Critical Success The creature takes double damage and gains the restrained condition until the end of its next turn (Escape DC 15). Success The creature takes 1d6 piercing damage and gains the grappled condition until the end of its next turn (Escape DC 15). --- Reset This trap must be manually reset."
  },
  {
    "id": "aon-hazards--2-archivists-wrath",
    "name": "Archivist's Wrath",
    "level": 1,
    "complexity": "complex",
    "type": "trap",
    "traits": [
      "Tech",
      "Unique"
    ],
    "source": "Starfinder Murder in Metal City Deluxe Adventure",
    "description": "This network of security cameras, wall-mounted retractable turrets, and laser nets are controlled by Archivist 404, who commands them to blast",
    "stealth": "+7 (trained)",
    "stealthDC": 7,
    "disable": "DC 13 Computers (trained) overrides the security program; DC 15 Crafting or Thievery (trained) disables the hardlight projector; DC 17 Diplomacy convinces the Archivist to reconsider. Four total successes are required to end the program.",
    "reset": "Every 6 hours, a backup program restores Archivist 404's original personality data to the projector if it’s been disabled.",
    "ac": 14,
    "saves": {},
    "hp": 24,
    "bt": 12,
    "actions": [
      {
        "name": "Intruder Alert!",
        "actionType": "reaction",
        "trigger": "Archivist 404 detects intruders",
        "effect": "Dozens of tiny nodes concealed in the walls, floor, and ceiling unleash a kaleidoscopic barrage of lasers that deal 1d6 fire damage to all non-hardlight creatures in Archive 404 (DC 15 basic Reflex save). Then the hazard rolls initiative."
      }
    ],
    "routine": "Archivist 404 fires one laser at each intruder in the archive as one action. It takes a cumulative –1 status penalty to its attack rolls for each successful check the PCs have made to disable it.",
    "actionsPerRound": 1,
    "rawText": " Archivist's Wrath Source Starfinder Murder in Metal City Deluxe Adventure pg. 23 Complexity Complex This network of security cameras, wall-mounted retractable turrets, and laser nets are controlled by Archivist 404, who commands them to blast intruders with extreme prejudice. --- Stealth +7 (trained) Disable DC 13 Computers (trained) overrides the security program; DC 15 Crafting or Thievery (trained) disables the hardlight projector; DC 17 Diplomacy convinces the Archivist to reconsider. Four total successes are required to end the program. AC 14 Projector Hardness 2 Projector HP 24 (BT 12) Intruder Alert! Reaction Trigger Archivist 404 detects intruders; Effect Dozens of tiny nodes concealed in the walls, floor, and ceiling unleash a kaleidoscopic barrage of lasers that deal 1d6 fire damage to all non-hardlight creatures in Archive 404 (DC 15 basic Reflex save). Then the hazard rolls initiative. --- Routine (1 action) Archivist 404 fires one laser at each intruder in the archive as one action. It takes a cumulative –1 status penalty to its attack rolls for each successful check the PCs have made to disable it. Ranged laser +9, Damage 1d6+3 fire; no multiple attack penalty --- Reset Every 6 hours, a backup program restores Archivist 404's original personality data to the projector if it’s been disabled."
  },
  {
    "id": "aon-hazards--3-dewblossom",
    "name": "Dewblossom",
    "level": 1,
    "complexity": "complex",
    "type": "environmental",
    "traits": [
      "Environmental",
      "Rare"
    ],
    "source": "Starfinder Murder in Metal City Deluxe Adventure",
    "description": "A fragrant aroma beckons the senses toward a smooth bed of soft moss. In its center, a beautiful flower is opening to catch the light—its shimmering",
    "stealth": "+7 (trained)",
    "stealthDC": 7,
    "disable": "DC 14 Athletics (trained) to wrestle the dewblossom's vines, DC 14 Acrobatics (trained) to dodge around it, DC 13 Nature (trained) to entice the flower to cease its attacks; four total successes are required to disable the hazard, or dealing enough damage to the dewblossom to reduce it to half its HP (whichever comes first). A creature who succeeds at any of these checks gains a +2 circumstance bonus to saves and AC against its attacks.",
    "reset": "The dewblossom stops attacking when it's disabled, 1 minute after it detects prey, when it's reduced to half HP, or when its victim is unconscious. It spits out its victim (if conscious), uproots, tucks its leaves around its body, and rolls away with a land speed of 100 feet per round. It resets after 1 hour (or 1 day if it needs to digest its meal).",
    "ac": 13,
    "saves": {
      "fortitude": 8,
      "reflex": 2
    },
    "hp": 24,
    "actions": [
      {
        "name": "Detect Prey",
        "actionType": "reaction",
        "effect": "(olfactory) **Trigger** A creature comes within 60 feet of the dewblossom; **Effect** The dewblossom's sensitive root network detects vibrations created by the PCs' movements. The dewblossom opens its luring flower; creatures within 100 feet must attempt a DC 15 Will save. On a failure, the creature must spend its next action to move as close to the dewblossom as possible (or its next two actions on a critical failure). Then, the dewblossom rolls initiative."
      },
      {
        "name": "Thorn Dart",
        "actionType": "free",
        "trigger": "A creature within 60 feet damages the dewblossom with an attack",
        "effect": "The dewblossom fires a thorn dart at the triggering creature. The target takes 1d4 piercing damage (DC 17 basic Reflex save)."
      },
      {
        "name": "Melee",
        "actionType": 1,
        "effect": "vine snatch +9 (reach 30 feet); Damage 1d6+3 slashing plus rancid grip"
      }
    ],
    "routine": "The dewblossom makes a vine snatch attack against the nearest creature.",
    "actionsPerRound": 1,
    "rawText": " Dewblossom Source Starfinder Murder in Metal City Deluxe Adventure pg. 31 Complexity Complex A fragrant aroma beckons the senses toward a smooth bed of soft moss. In its center, a beautiful flower is opening to catch the light—its shimmering velvet petals have nearly unfurled. A stamen curls out in slow spiral motion, and the alluring scent sours to the stench of rancid meat and feces. --- Stealth +7 (trained) Disable DC 14 Athletics (trained) to wrestle the dewblossom's vines, DC 14 Acrobatics (trained) to dodge around it, DC 13 Nature (trained) to entice the flower to cease its attacks; four total successes are required to disable the hazard, or dealing enough damage to the dewblossom to reduce it to half its HP (whichever comes first). A creature who succeeds at any of these checks gains a +2 circumstance bonus to saves and AC against its attacks. AC 13, Fort +8, Ref +2 HP 24 Weaknesses fire 3 Detect Prey Reaction (olfactory) Trigger A creature comes within 60 feet of the dewblossom; Effect The dewblossom's sensitive root network detects vibrations created by the PCs' movements. The dewblossom opens its luring flower; creatures within 100 feet must attempt a DC 15 Will save. On a failure, the creature must spend its next action to move as close to the dewblossom as possible (or its next two actions on a critical failure). Then, the dewblossom rolls initiative. Thorn Dart Free Action Trigger A creature within 60 feet damages the dewblossom with an attack; Effect The dewblossom fires a thorn dart at the triggering creature. The target takes 1d4 piercing damage (DC 17 basic Reflex save). --- Routine (1 action) The dewblossom makes a vine snatch attack against the nearest creature. Melee Single Action vine snatch +9 (reach 30 feet); Damage 1d6+3 slashing plus rancid grip Rancid Grip The target is trapped in the dewblossom's crushing flower, gaining the grabbed condition until it Escapes (DC 17). At the end of each of the target's turns that it remains grabbed, the target takes 1d6+3 poison damage. --- Reset The dewblossom stops attacking when it's disabled, 1 minute after it detects prey, when it's reduced to half HP, or when its victim is unconscious. It spits out its victim (if conscious), uproots, tucks its leaves around its body, and rolls away with a land speed of 100 feet per round. It resets after 1 hour (or 1 day if it needs to digest its meal)."
  },
  {
    "id": "aon-hazards--29-distracting-holo-ad",
    "name": "Distracting Holo Ad",
    "level": 1,
    "complexity": "complex",
    "type": "trap",
    "traits": [
      "Magical",
      "Tech",
      "Trap"
    ],
    "source": "GM Core",
    "description": "Colorful, lifelike figures flit in and out of a holographic advertisement in a barrage of pleasant sounds and sensations, enticing passersby to spend",
    "stealth": "+7 (trained), or DC 20 (expert) to notice the holoprojector, or  detect magic ",
    "stealthDC": 7,
    "disable": "DC 17 Computers (trained) to deactivate the ad, or DC 20 Crafting (trained) or Thievery (trained) to disable the projector",
    "reset": "The trap deactivates and resets after 1 minute.",
    "ac": 16,
    "saves": {
      "fortitude": 4,
      "reflex": 11
    },
    "hp": 24,
    "bt": 12,
    "immunities": [
      "critical hits",
      "object immunities",
      "precision damage"
    ],
    "actions": [
      {
        "name": "Buy! Buy! Buy!",
        "actionType": "reaction",
        "effect": "(incapacitation, mental) **Trigger** A creature in the area finishes an action; **Effect** The trap launches a targeted ad enticing viewers to spend credits on a product or service. All creatures within 30 feet who can see, hear, or sense the ad must attempt a DC 17 Will save. The trap rolls initiative."
      }
    ],
    "routine": "The hazard plays a new ad each round, forcing all creatures that can sense it to attempt a new save.",
    "actionsPerRound": 1,
    "rawText": " Distracting Holo Ad Source GM Core pg. 110 Complexity Complex Colorful, lifelike figures flit in and out of a holographic advertisement in a barrage of pleasant sounds and sensations, enticing passersby to spend their credits. The hologram's source is a nearby projector. --- Stealth +7 (trained), or DC 20 (expert) to notice the holoprojector, or detect magic Disable DC 17 Computers (trained) to deactivate the ad, or DC 20 Crafting (trained) or Thievery (trained) to disable the projector AC 16, Fort +4, Ref +11 Projector Hardness 5 Projector HP 24 (BT 12) Immunities critical hits, object immunities, precision damage Buy! Buy! Buy! Reaction (incapacitation, mental) Trigger A creature in the area finishes an action; Effect The trap launches a targeted ad enticing viewers to spend credits on a product or service. All creatures within 30 feet who can see, hear, or sense the ad must attempt a DC 17 Will save. The trap rolls initiative. Critical Success The target is unaffected. Success The target is dazzled. Failure The target is dazzled and slowed 1. Critical Failure The target is fascinated for 1 round and can't take any actions except to access the nearest computer or comm unit and make purchases as directed by the ad. --- Routine (1 action) The hazard plays a new ad each round, forcing all creatures that can sense it to attempt a new save. --- Reset The trap deactivates and resets after 1 minute."
  },
  {
    "id": "aon-hazards--33-laser-turret",
    "name": "Laser Turret",
    "level": 1,
    "complexity": "complex",
    "type": "trap",
    "traits": [
      "Mechanical",
      "Tech",
      "Trap"
    ],
    "source": "GM Core",
    "description": "A concealed turret pops up and fires a laser when intruders enter a secure area.",
    "stealth": "10 (trained)",
    "stealthDC": 10,
    "disable": "DC 18 Computers (trained) to reprogram the turret, or DC 17 Crafting (trained) to cut power to the turret, or DC 16 Thievery (trained) to disable the turret",
    "reset": "The trap resets after 1 minute.",
    "ac": 16,
    "saves": {
      "fortitude": 10,
      "reflex": 4
    },
    "hardness": 5,
    "hp": 24,
    "bt": 12,
    "immunities": [
      "critical hits",
      "object immunities",
      "precision damage"
    ],
    "attackBonus": 9,
    "damage": "1d6+3 fire",
    "actions": [
      {
        "name": "Laser Blast",
        "actionType": "reaction",
        "trigger": "A creature moves within 30 feet of the turret",
        "effect": "The trap makes a laser Strike against the creature; the trap rolls initiative."
      }
    ],
    "routine": "The trap makes a laser Strike against up to three creatures in range, or multiple Strikes against one creature in range if it has no additional targets.",
    "actionsPerRound": 3,
    "rawText": " Laser Turret Source GM Core pg. 111 Complexity Complex A concealed turret pops up and fires a laser when intruders enter a secure area. --- Stealth 10 (trained) Disable DC 18 Computers (trained) to reprogram the turret, or DC 17 Crafting (trained) to cut power to the turret, or DC 16 Thievery (trained) to disable the turret AC 16, Fort +10, Ref +4 Hardness 5 HP 24 (BT 12) Immunities critical hits, object immunities, precision damage Laser Blast Reaction Trigger A creature moves within 30 feet of the turret; Effect The trap makes a laser Strike against the creature; the trap rolls initiative. --- Routine (3 actions) The trap makes a laser Strike against up to three creatures in range, or multiple Strikes against one creature in range if it has no additional targets. Ranged laser +9 (range increment 90 feet), Damage 1d6+3 fire --- Reset The trap resets after 1 minute."
  },
  {
    "id": "aon-hazards--4-particle-cannon",
    "name": "Particle Cannon",
    "level": 1,
    "complexity": "complex",
    "type": "trap",
    "traits": [
      "Tech",
      "Trap",
      "Unique"
    ],
    "source": "Starfinder Murder in Metal City Deluxe Adventure",
    "description": "A glowering purple eye opens in the ship's hull. The triple barrels of a massive turret spin inside the revealed port, then release a beam of",
    "stealth": "+5 (trained)",
    "stealthDC": 5,
    "disable": "DC 14 Crafting (trained) or Thievery (trained) to disable or jam the particle cannon, DC 17 Arcana, Occultism, Nature, or Religion (trained) to counteract the particle beam by exploiting a magical theory or praying for a miraculous malfunction.",
    "reset": "If disabled, the cannon is inactive for 1 round while  Hura  troubleshoots the issue, then it resumes firing. Hura  stops  firing  if the lookouts are killed or the cannon is disabled  three  or  more times.",
    "ac": 14,
    "saves": {
      "fortitude": 4
    },
    "hardness": 5,
    "hp": 24,
    "bt": 12,
    "actions": [
      {
        "name": "Charge Up",
        "actionType": "reaction",
        "trigger": "A lookout identifies a threat",
        "effect": "Hura takes the gunner position. The particle cannon rolls initiative."
      }
    ],
    "routine": "Hura fires a charged shot from the particle cannon, dealing 1d6+3 fire damage to each creature in a 90- foot line (DC 14 basic Reflex save).",
    "actionsPerRound": 2,
    "rawText": " Particle Cannon Source Starfinder Murder in Metal City Deluxe Adventure pg. 33 Complexity Complex A glowering purple eye opens in the ship's hull. The triple barrels of a massive turret spin inside the revealed port, then release a beam of concentrated particles with ruthless efficiency. --- Stealth +5 (trained) Disable DC 14 Crafting (trained) or Thievery (trained) to disable or jam the particle cannon, DC 17 Arcana, Occultism, Nature, or Religion (trained) to counteract the particle beam by exploiting a magical theory or praying for a miraculous malfunction. AC 14, Fort +4, Ref +0 Hardness 5 HP 24 (BT 12) Charge Up Reaction Trigger A lookout identifies a threat; Effect Hura takes the gunner position. The particle cannon rolls initiative. --- Routine (2 actions) Hura fires a charged shot from the particle cannon, dealing 1d6+3 fire damage to each creature in a 90- foot line (DC 14 basic Reflex save). --- Reset If disabled, the cannon is inactive for 1 round while Hura troubleshoots the issue, then it resumes firing. Hura stops firing if the lookouts are killed or the cannon is disabled three or more times."
  },
  {
    "id": "aon-hazards--1-shadowy-duplicates",
    "name": "Shadowy Duplicates",
    "level": 1,
    "complexity": "complex",
    "type": "trap",
    "traits": [
      "Magical",
      "Unique"
    ],
    "source": "Starfinder Murder in Metal City Deluxe Adventure",
    "description": "Four duplicates of a shadowy figure produce a quasi-real quantum field that warps the fabric of reality, then attack with echoes of reality-slicing",
    "stealth": "+7 (trained)",
    "stealthDC": 7,
    "disable": "DC 14 Arcana or Occultism to disable a duplicate by sealing it away from this reality, DC 15 Engineering Lore or Physical Science Lore to disable the quantum field with contradicting theory, or DC 16 Athletics to disable a duplicate by physical force",
    "reset": "The duplicates vanish after 1 minute and never reappear.",
    "ac": 13,
    "saves": {
      "fortitude": 10,
      "reflex": 4
    },
    "hp": 6,
    "bt": 3,
    "actions": [
      {
        "name": "Quantum Field",
        "actionType": "reaction",
        "trigger": "The shadowy duplicates appear and threaten the PCs",
        "effect": "The duplicates warp reality, creating a quantum field. This field is a 30-foot-radius burst centered on any point within 100 feet of a duplicate, and it's positioned to affect as many PCs as possible. This area is difficult terrain. Then the hazard rolls initiative."
      }
    ],
    "routine": "The shadowy duplicates lose 1 action each turn for each destroyed or disabled duplicate. On each of the hazard's actions, a duplicate moves up to 20 feet (ignoring the quantum field's difficult terrain) or moves the quantum field up to 20 feet, then emits a mind-slicing blast against one creature within 40 feet.",
    "actionsPerRound": 4,
    "rawText": " Shadowy Duplicates Source Starfinder Murder in Metal City Deluxe Adventure pg. 13 Complexity Complex Four duplicates of a shadowy figure produce a quasi-real quantum field that warps the fabric of reality, then attack with echoes of reality-slicing magic. --- Stealth +7 (trained) Disable DC 14 Arcana or Occultism to disable a duplicate by sealing it away from this reality, DC 15 Engineering Lore or Physical Science Lore to disable the quantum field with contradicting theory, or DC 16 Athletics to disable a duplicate by physical force AC 13, Fort +10, Ref +4 Duplicate HP 6 each (BT 3) Quantum Field Reaction Trigger The shadowy duplicates appear and threaten the PCs; Effect The duplicates warp reality, creating a quantum field. This field is a 30-foot-radius burst centered on any point within 100 feet of a duplicate, and it's positioned to affect as many PCs as possible. This area is difficult terrain. Then the hazard rolls initiative. --- Routine (4 actions) The shadowy duplicates lose 1 action each turn for each destroyed or disabled duplicate. On each of the hazard's actions, a duplicate moves up to 20 feet (ignoring the quantum field's difficult terrain) or moves the quantum field up to 20 feet, then emits a mind-slicing blast against one creature within 40 feet. Ranged mind-slicing blast +9, Damage 1d4 piercing plus 1d4 mental; no multiple attack penalty --- Reset The duplicates vanish after 1 minute and never reappear."
  },
  {
    "id": "aon-hazards--41-spinning-treadmills",
    "name": "Spinning Treadmills",
    "level": 1,
    "complexity": "complex",
    "type": "trap",
    "traits": [
      "Mechanical",
      "Trap"
    ],
    "source": "Guilt of the Grave World",
    "description": "These three treadmills' rotating belts are no longer locked in place and now spin freely when activated.",
    "stealth": "DC 17 (trained)",
    "stealthDC": 17,
    "disable": "DC 13 Sports Lore to remember that older models of treadmills have an emergency brake that can be activated with a pull string, DC 15 Thievery to jam the mechanism, or DC 17 Crafting to improvise a stop for the rotating belts",
    "reset": "The trap resets automatically until disabled.",
    "ac": 15,
    "saves": {
      "fortitude": 10,
      "reflex": 2
    },
    "hardness": 5,
    "hp": 20,
    "bt": 10,
    "immunities": [
      "critical hits",
      "object immunities",
      "precision damage"
    ],
    "actions": [
      {
        "name": "Spin-Off",
        "actionType": "reaction",
        "trigger": "A creature steps on the treadmill",
        "effect": "The creature must attempt a DC 15 Reflex save."
      }
    ],
    "rawText": " Spinning Treadmills Source Guilt of the Grave World pg. 22 Complexity Complex These three treadmills' rotating belts are no longer locked in place and now spin freely when activated. --- Stealth DC 17 (trained) Disable DC 13 Sports Lore to remember that older models of treadmills have an emergency brake that can be activated with a pull string, DC 15 Thievery to jam the mechanism, or DC 17 Crafting to improvise a stop for the rotating belts AC 15, Fort +10, Ref +2 Hardness 5 HP 20 (BT 10) Immunities critical hits, object immunities, precision damage Spin-Off Reaction Trigger A creature steps on the treadmill; Effect The creature must attempt a DC 15 Reflex save. Critical Success The creature is unaffected. Success The creature is pushed back 5 feet. Failure The creature is knocked prone and pushed back 5 feet. Critical Failure The creature is knocked prone, takes 1d6 bludgeoning damage, and is pushed back 10 feet. If this forced movement would have the PC impact another creature, that subsequent creature must succeed at a DC 15 Reflex save or be knocked prone. --- Reset The trap resets automatically until disabled."
  },
  {
    "id": "aon-hazards--38-summoning-rune",
    "name": "Summoning Rune",
    "level": 1,
    "complexity": "complex",
    "type": "trap",
    "traits": [
      "Magical",
      "Trap"
    ],
    "source": "GM Core",
    "description": "A cloud of invisible magical sensors in a 10-foot radius surrounds an invisible rune on the wall or floor the size of the creature to be summoned.",
    "stealth": "7 (trained)",
    "stealthDC": 7,
    "disable": "DC 15 Acrobatics to approach without triggering the trap followed by DC 17 Thievery (trained) to erase the rune, or  dispel magic  (1st rank; counteract DC 15) to counteract the rune",
    "reset": "The trap resets each day at dawn.",
    "saves": {},
    "actions": [
      {
        "name": "Summon Monster",
        "actionType": "reaction",
        "effect": "(arcane) **Trigger** A creature enters the cloud of magical sensors; **Effect** This trap summons a specific 1st-level creature, determined when the trap is created. The creature rolls initiative and remains for 2d6 rounds, after which the spell ends and the creature disappears. The creature also disappears if someone disables the trap before the duration expires. The summoned creature can use 3 actions each round and can use reactions, unlike most summoned creatures."
      }
    ],
    "rawText": " Summoning Rune Source GM Core pg. 112 Complexity Complex A cloud of invisible magical sensors in a 10-foot radius surrounds an invisible rune on the wall or floor the size of the creature to be summoned. --- Stealth 7 (trained) Disable DC 15 Acrobatics to approach without triggering the trap followed by DC 17 Thievery (trained) to erase the rune, or dispel magic (1st rank; counteract DC 15) to counteract the rune Summon Monster Reaction (arcane) Trigger A creature enters the cloud of magical sensors; Effect This trap summons a specific 1st-level creature, determined when the trap is created. The creature rolls initiative and remains for 2d6 rounds, after which the spell ends and the creature disappears. The creature also disappears if someone disables the trap before the duration expires. The summoned creature can use 3 actions each round and can use reactions, unlike most summoned creatures. --- Reset The trap resets each day at dawn. Upgraded Summoning Runes You can make a summoning rune of nearly any level. It summons a creature of a level equal to the trap's level. Use the DCs by Level table to determine the Thievery DC and spell DC, using the trap's level and applying a hard adjustment (+2). The Stealth modifier for the trap is equal to this number – 10. Stronger summoning runes usually require expert proficiency or better in Perception to find, and they might require a higher proficiency rank in Thievery to disable."
  },
  {
    "id": "aon-hazards--24-venting-airlock",
    "name": "Venting Airlock",
    "level": 1,
    "complexity": "complex",
    "type": "trap",
    "traits": [
      "Mechanical",
      "Trap"
    ],
    "source": "GM Core",
    "description": "A malfunctioning airlock opens unexpectedly while creatures are inside.",
    "stealth": "14 (trained)",
    "stealthDC": 14,
    "disable": "DC 17 Crafting (trained) to repair the airlock, or DC 17 Thievery (trained) to jam the airlock closed",
    "saves": {},
    "actions": [
      {
        "name": "Vent",
        "actionType": "reaction",
        "trigger": "One or more creatures enters the airlock compartment",
        "effect": "The outer airlock door opens, venting breathable air out into the vacuum or harmful atmosphere beyond. The creature begins suffocating and must attempt a DC 20 Reflex save."
      }
    ],
    "rawText": " Venting Airlock Source GM Core pg. 108 Complexity Complex A malfunctioning airlock opens unexpectedly while creatures are inside. --- Stealth 14 (trained) Disable DC 17 Crafting (trained) to repair the airlock, or DC 17 Thievery (trained) to jam the airlock closed Vent Reaction Trigger One or more creatures enters the airlock compartment; Effect The outer airlock door opens, venting breathable air out into the vacuum or harmful atmosphere beyond. The creature begins suffocating and must attempt a DC 20 Reflex save. Success The target is unaffected. Failure The target is sucked 10 feet out of the airlock and takes 2d6 bludgeoning damage. Critical Failure The target is sucked 10 feet out of the airlock and takes 4d6 bludgeoning damage.\n"
  },
  {
    "id": "aon-hazards--48-burning-rockslide",
    "name": "Burning Rockslide",
    "level": 2,
    "complexity": "complex",
    "type": "environmental",
    "traits": [
      "Environmental"
    ],
    "source": "Guilt of the Grave World",
    "description": "Smoldering boulders are disgorged by the magmatic soil and roll down the slope, catching fire as they descend.",
    "stealth": "DC 18 (trained)",
    "stealthDC": 18,
    "disable": "DC 16 Nature (trained), Physical Science Lore (trained), or Survival (trained) to guess the rocks' path, or a DC 18 Acrobatics (trained), Athletics (trained) or a Fortitude save to deflect or dodge rocks.",
    "saves": {},
    "actions": [
      {
        "name": "Catching Fire",
        "actionType": "reaction",
        "trigger": "Creatures climb the slope",
        "effect": "Molten lava oozes down the slope, coming perilously close to the path and igniting the debris nearby—even the rocks. All creatures in a 30-foot burst take 1d10+4 bludgeoning damage and 1d10+4 fire damage with a DC 16 basic Reflex save. On a critical failure the creature also catches on fire."
      }
    ],
    "rawText": " Burning Rockslide Source Guilt of the Grave World pg. 64 Complexity Complex Smoldering boulders are disgorged by the magmatic soil and roll down the slope, catching fire as they descend. --- Stealth DC 18 (trained) Disable DC 16 Nature (trained), Physical Science Lore (trained), or Survival (trained) to guess the rocks' path, or a DC 18 Acrobatics (trained), Athletics (trained) or a Fortitude save to deflect or dodge rocks. Catching Fire Reaction Trigger Creatures climb the slope; Effect Molten lava oozes down the slope, coming perilously close to the path and igniting the debris nearby—even the rocks. All creatures in a 30-foot burst take 1d10+4 bludgeoning damage and 1d10+4 fire damage with a DC 16 basic Reflex save. On a critical failure the creature also catches on fire."
  },
  {
    "id": "aon-hazards--9-explosive-overload",
    "name": "Explosive Overload",
    "level": 2,
    "complexity": "complex",
    "type": "trap",
    "traits": [
      "Mechanical",
      "Trap"
    ],
    "source": "GM Core",
    "description": "A generator, engine, or other large immobile device overloads and is moments from catastrophically exploding.",
    "stealth": "14",
    "stealthDC": 14,
    "disable": "DC 19 Crafting (trained) to safely shut down the device, or DC 21 Thievery (trained) to quickly vent the device",
    "saves": {},
    "actions": [
      {
        "name": "Explode",
        "actionType": "reaction",
        "trigger": "A creature moves within 30 feet of the device",
        "effect": "The trap makes a loud noise. At the end of the next round, the device explodes, dealing 2d6+5 piercing damage to all creatures within 15 feet of the device (DC 18 basic Reflex save). This explosion destroys the device."
      }
    ],
    "rawText": " Explosive Overload Source GM Core pg. 106 Complexity Complex A generator, engine, or other large immobile device overloads and is moments from catastrophically exploding. --- Stealth 14 Disable DC 19 Crafting (trained) to safely shut down the device, or DC 21 Thievery (trained) to quickly vent the device Explode Reaction Trigger A creature moves within 30 feet of the device; Effect The trap makes a loud noise. At the end of the next round, the device explodes, dealing 2d6+5 piercing damage to all creatures within 15 feet of the device (DC 18 basic Reflex save). This explosion destroys the device."
  },
  {
    "id": "aon-hazards--31-hackers-folly",
    "name": "Hacker's Folly",
    "level": 2,
    "complexity": "complex",
    "type": "haunt",
    "traits": [
      "Haunt",
      "Tech"
    ],
    "source": "GM Core",
    "description": "A ghostly hacker haunts their computer and attempts to drain the spirit of anyone who accessed the computer.",
    "stealth": "15 (trained)",
    "stealthDC": 15,
    "disable": "DC 16 Computers (trained) to partition the haunted code, or DC 18 Religion (trained) or Occultism (trained) to exorcise the spirit",
    "reset": "The trap resets after 1 hour.",
    "ac": 15,
    "saves": {
      "fortitude": 11,
      "reflex": 5
    },
    "hp": 40,
    "bt": 20,
    "immunities": [
      "critical hits",
      "object immunities",
      "precision damage"
    ],
    "actions": [
      {
        "name": "Hacker's Fixation",
        "actionType": "reaction",
        "effect": "(mental, visual) **Trigger** A creature touches the console directly or with a tool; **Effect** The haunt distracts the user with colorful graphics and interesting data while lowering their mental defenses. The triggering creature must attempt a DC 22 Will save. The trap then rolls initiative."
      }
    ],
    "routine": "The haunt absorbs the spirits of the living, dealing 1d10+4 spirit damage to all living creatures within 10 feet of the computer (DC 18 basic Will save). On a critical failure, a creature is additionally drained 1. This routine doesn't count as a hostile action for the purposes of ending the fascinated condition.",
    "actionsPerRound": 1,
    "rawText": " Hacker's Folly Source GM Core pg. 110 Complexity Complex A ghostly hacker haunts their computer and attempts to drain the spirit of anyone who accessed the computer. --- Stealth 15 (trained) Disable DC 16 Computers (trained) to partition the haunted code, or DC 18 Religion (trained) or Occultism (trained) to exorcise the spirit AC 15, Fort +11, Ref +5 Computer Hardness 2 HP 40 (BT 20) Immunities critical hits, object immunities, precision damage Hacker's Fixation Reaction (mental, visual) Trigger A creature touches the console directly or with a tool; Effect The haunt distracts the user with colorful graphics and interesting data while lowering their mental defenses. The triggering creature must attempt a DC 22 Will save. The trap then rolls initiative. Critical Success The creature is unaffected. Success The creature is stupefied 1 for 1 round. Failure The creature is stupefied 1. Critical Failure The creature is stupefied 2. Additionally, they are fascinated with the computer and can't take any actions except to passively view the data on the computer. At the end of each of their turns, they can retry this saving throw to remove the fascinated condition. --- Routine (1 action) The haunt absorbs the spirits of the living, dealing 1d10+4 spirit damage to all living creatures within 10 feet of the computer (DC 18 basic Will save). On a critical failure, a creature is additionally drained 1. This routine doesn't count as a hostile action for the purposes of ending the fascinated condition. --- Reset The trap resets after 1 hour."
  },
  {
    "id": "aon-hazards--52-rapid-depressurization",
    "name": "Rapid Depressurization",
    "level": 2,
    "complexity": "complex",
    "type": "environmental",
    "traits": [
      "Environmental"
    ],
    "source": "Guilt of the Grave World",
    "description": "A stray shot shatters a window, sucking out the room’s precious atmosphere.",
    "stealth": "DC 16",
    "stealthDC": 16,
    "disable": "DC 14 Crafting (trained) or Labor Lore (trained) while adjacent to the window to patch the hole, DC 16 Computers (trained) to activate an emergency metal shutter from any console in the room, or DC 18 Survival or Thievery to cover the hole (if adjacent) with a random object as a temporary fix.",
    "reset": "1 minute after a depressurization hazard begins, all air escapes from the area (requiring living creatures to activate their environmental protections or begin suffocating). If the hazard is disabled before 1 minute has passed, this timer resets.",
    "saves": {},
    "actions": [
      {
        "name": "Blow Out",
        "actionType": "reaction",
        "trigger": "A ranged attack critically fails",
        "effect": "All corporeal creatures inside area are suppressed until the hazard is disabled or 1 minute has passed."
      }
    ],
    "rawText": " Rapid Depressurization Source Guilt of the Grave World pg. 88 Complexity Complex A stray shot shatters a window, sucking out the room’s precious atmosphere. --- Stealth DC 16 Disable DC 14 Crafting (trained) or Labor Lore (trained) while adjacent to the window to patch the hole, DC 16 Computers (trained) to activate an emergency metal shutter from any console in the room, or DC 18 Survival or Thievery to cover the hole (if adjacent) with a random object as a temporary fix. Blow Out Reaction Trigger A ranged attack critically fails; Effect All corporeal creatures inside area are suppressed until the hazard is disabled or 1 minute has passed. --- Reset 1 minute after a depressurization hazard begins, all air escapes from the area (requiring living creatures to activate their environmental protections or begin suffocating). If the hazard is disabled before 1 minute has passed, this timer resets."
  },
  {
    "id": "aon-hazards--40-rejuvenating-projector",
    "name": "Rejuvenating Projector",
    "level": 2,
    "complexity": "complex",
    "type": "trap",
    "traits": [
      "Magical",
      "Trap"
    ],
    "source": "Guilt of the Grave World",
    "description": "Hardlight scamps spawn from this antique projector and harass nearby living creatures.",
    "stealth": "+10 (trained)",
    "stealthDC": 10,
    "disable": "DC 20 Arcana (trained) to depower the magical circuits, DC 20 Computers (trained) to reprogram the projector, or DC 20 Athletics (trained) to rip the projector out of the wall.",
    "reset": "The trap deactivates after 6 rounds and resets after 1 hour.",
    "saves": {},
    "hp": 42,
    "bt": 21,
    "immunities": [
      "critical hits",
      "object immunities",
      "precision damage"
    ],
    "actions": [
      {
        "name": "Generate Scamp",
        "actionType": "free",
        "trigger": "Two or more living creatures enter area",
        "effect": "The projector creates two hardlight scamps. This projector can manifest only two scamps at a time. The scamps roll initiative. The scamps disappear when slain, or if their projector is deactivated or destroyed."
      },
      {
        "name": "Infuse Scamp",
        "actionType": "reaction",
        "trigger": "A hardlight scamp is critically hit but not destroyed",
        "effect": "The affected hardlight scamp regains 1d8 Hit Points."
      }
    ],
    "rawText": " Rejuvenating Projector Source Guilt of the Grave World pg. 20 Complexity Complex Hardlight scamps spawn from this antique projector and harass nearby living creatures. --- Stealth +10 (trained) Disable DC 20 Arcana (trained) to depower the magical circuits, DC 20 Computers (trained) to reprogram the projector, or DC 20 Athletics (trained) to rip the projector out of the wall. Projector Hardness 10 Projector HP 42 (BT 21) Immunities critical hits, object immunities, precision damage Generate Scamp Free Action Trigger Two or more living creatures enter area; Effect The projector creates two hardlight scamps. This projector can manifest only two scamps at a time. The scamps roll initiative. The scamps disappear when slain, or if their projector is deactivated or destroyed. Infuse Scamp Reaction Trigger A hardlight scamp is critically hit but not destroyed; Effect The affected hardlight scamp regains 1d8 Hit Points. --- Reset The trap deactivates after 6 rounds and resets after 1 hour."
  },
  {
    "id": "aon-hazards--23-tranquilizer-darts-trap",
    "name": "Tranquilizer Darts Trap",
    "level": 2,
    "complexity": "complex",
    "type": "trap",
    "traits": [
      "Mechanical",
      "Trap"
    ],
    "source": "GM Core",
    "description": "Weight-sensitive pressure plates in the floor trigger a hole at the hallway's end to fire tranquilizer darts at creatures in the hall.",
    "stealth": "21 (trained)",
    "stealthDC": 21,
    "disable": "DC 18 Crafting (trained) or Thievery (trained) to disable the pressure plates",
    "saves": {},
    "attackBonus": 14,
    "damage": "1d6 piercing and 1d6 poison plus tranquilizer; no multiple attack penalty",
    "actions": [
      {
        "name": "Dart Volley",
        "actionType": "reaction",
        "trigger": "A creature steps on a pressure plate",
        "effect": "The trap makes a tranquilizer dart Strike against up to three creatures in the hall."
      }
    ],
    "rawText": " Tranquilizer Darts Trap Source GM Core pg. 108 Complexity Complex Weight-sensitive pressure plates in the floor trigger a hole at the hallway's end to fire tranquilizer darts at creatures in the hall. --- Stealth 21 (trained) Disable DC 18 Crafting (trained) or Thievery (trained) to disable the pressure plates Dart Volley Reaction Trigger A creature steps on a pressure plate; Effect The trap makes a tranquilizer dart Strike against up to three creatures in the hall. Ranged tranquilizer dart +14, Damage 1d6 piercing and 1d6 poison plus tranquilizer; no multiple attack penalty Tranquilizer (incapacitation, poison) Saving Throw DC 18 Fortitude Maximum Duration 4 rounds; Stage 1 clumsy 1 (1 round); Stage 2 clumsy 1 and stunned 1 (1 round); Stage 3 clumsy 2 and asleep for 1 minute (1 minute)"
  },
  {
    "id": "aon-hazards--43-doomed-shuttle",
    "name": "Doomed Shuttle",
    "level": 3,
    "complexity": "complex",
    "type": "trap",
    "traits": [
      "Magical",
      "Tech",
      "Trap",
      "Uncommon"
    ],
    "source": "Guilt of the Grave World",
    "description": "The planetary shuttle has already taken severe damage to its engines and hull, sending it on a crash course toward the planet. Meanwhile, a",
    "stealth": "+12 (trained) to notice necromantic energy emanating from the cockpit (allowing the use of Arcana to Disable).",
    "stealthDC": 12,
    "disable": "DC 16 Piloting (trained) to take control and force the shuttle to a lower altitude, DC 18 Arcana (trained) or Thievery (trained) to counter the necroblast long enough to prevent its detonation, DC 20 Perception to look for the closest landing zone, DC 20 Crafting (trained) to take apart the console and defuse the bomb, DC 23 Religion to pray for divine intercession; four total successes are required to defeat the hazard. A creature that succeeds at any of these checks gains a +1 circumstance bonus on their save against the hazard's damage for 1 round.",
    "reset": "The bomb goes off after 4 rounds.",
    "saves": {},
    "actions": [
      {
        "name": "Final Countdown",
        "actionType": "reaction",
        "trigger": "The encounter begins",
        "effect": "The necroblast begins its detonation countdown, and the doomed shuttle rolls initiative."
      }
    ],
    "routine": "Void energy leaks out from the console as the necroblast prepares to detonate. All creatures on the ship take 2d6+4 void damage (DC 18 basic Will save).",
    "actionsPerRound": 3,
    "rawText": " Doomed Shuttle Source Guilt of the Grave World pg. 31 Complexity Complex The planetary shuttle has already taken severe damage to its engines and hull, sending it on a crash course toward the planet. Meanwhile, a necromantic spell planted in the ship's computer will imminently unleash an explosion of void energy. --- Stealth +12 (trained) to notice necromantic energy emanating from the cockpit (allowing the use of Arcana to Disable). Disable DC 16 Piloting (trained) to take control and force the shuttle to a lower altitude, DC 18 Arcana (trained) or Thievery (trained) to counter the necroblast long enough to prevent its detonation, DC 20 Perception to look for the closest landing zone, DC 20 Crafting (trained) to take apart the console and defuse the bomb, DC 23 Religion to pray for divine intercession; four total successes are required to defeat the hazard. A creature that succeeds at any of these checks gains a +1 circumstance bonus on their save against the hazard's damage for 1 round. Final Countdown Reaction Trigger The encounter begins; Effect The necroblast begins its detonation countdown, and the doomed shuttle rolls initiative. --- Routine (3 actions) Void energy leaks out from the console as the necroblast prepares to detonate. All creatures on the ship take 2d6+4 void damage (DC 18 basic Will save). --- Reset The bomb goes off after 4 rounds."
  },
  {
    "id": "aon-hazards--30-electric-fence",
    "name": "Electric Fence",
    "level": 3,
    "complexity": "complex",
    "type": "trap",
    "traits": [
      "Mechanical",
      "Trap"
    ],
    "source": "GM Core",
    "description": "A 15-foot-tall electrified fence electrocutes anyone who touches it.",
    "stealth": "10 (trained)",
    "stealthDC": 10,
    "disable": "DC 17 Crafting (trained) to ground a 10-foot portion of the fence, or DC 18 Thievery (trained) to cut power to the fence",
    "ac": 16,
    "saves": {
      "fortitude": 12,
      "reflex": 6
    },
    "hardness": 10,
    "hp": 40,
    "bt": 20,
    "immunities": [
      "critical hits",
      "object immunities",
      "precision damage"
    ],
    "actions": [
      {
        "name": "Shock",
        "actionType": "free",
        "trigger": "A creature touches the fence directly or with a tool",
        "effect": "The trap deals 1d10 electricity damage to the triggering creature. The trap rolls initiative if it hasn't already."
      }
    ],
    "routine": "The trap electrocutes each creature touching the fence directly or with a tool, dealing 1d10 electricity damage (DC 23 basic Fortitude save).",
    "actionsPerRound": 1,
    "rawText": " Electric Fence Source GM Core pg. 110 Complexity Complex A 15-foot-tall electrified fence electrocutes anyone who touches it. --- Stealth 10 (trained) Disable DC 17 Crafting (trained) to ground a 10-foot portion of the fence, or DC 18 Thievery (trained) to cut power to the fence AC 16, Fort +12, Ref +6 Hardness 10 HP 40 (BT 20) Immunities critical hits, object immunities, precision damage Shock Free Action Trigger A creature touches the fence directly or with a tool; Effect The trap deals 1d10 electricity damage to the triggering creature. The trap rolls initiative if it hasn't already. --- Routine (1 action) The trap electrocutes each creature touching the fence directly or with a tool, dealing 1d10 electricity damage (DC 23 basic Fortitude save)."
  },
  {
    "id": "aon-hazards--13-laser-web",
    "name": "Laser Web",
    "level": 3,
    "complexity": "complex",
    "type": "trap",
    "traits": [
      "Mechanical",
      "Tech",
      "Trap"
    ],
    "source": "GM Core",
    "description": "Six sensors concealed in a 15-foot-long corridor fire lasers when they detect movement.",
    "stealth": "15 (trained)",
    "stealthDC": 15,
    "disable": "DC 15 Computers (trained) or Thievery (trained) to disable each sensor, or DC 23 Acrobatics (expert) to slip past each sensor",
    "ac": 22,
    "saves": {
      "fortitude": 12,
      "reflex": 6
    },
    "hp": 7,
    "bt": 3,
    "immunities": [
      "critical hits",
      "object immunities",
      "precision damage"
    ],
    "attackBonus": 16,
    "damage": "2d10+7 fire; no multiple attack penalty",
    "actions": [
      {
        "name": "Laser Web",
        "actionType": "reaction",
        "trigger": "A creature moves within 5 feet of a sensor",
        "effect": "The lasers fire, each one Striking a creature in the hallway. If there are more creatures than lasers, the lasers prioritize the triggering creature or creatures; if there are fewer creatures than lasers, the lasers prioritize Striking the triggering creature or creatures multiple times."
      }
    ],
    "rawText": " Laser Web Source GM Core pg. 106 Complexity Complex Six sensors concealed in a 15-foot-long corridor fire lasers when they detect movement. --- Stealth 15 (trained) Disable DC 15 Computers (trained) or Thievery (trained) to disable each sensor, or DC 23 Acrobatics (expert) to slip past each sensor AC 22, Fort +12, Ref +6 Sensor Hardness 4 Sensor HP 7 (BT 3) Immunities critical hits, object immunities, precision damage Laser Web Reaction Trigger A creature moves within 5 feet of a sensor; Effect The lasers fire, each one Striking a creature in the hallway. If there are more creatures than lasers, the lasers prioritize the triggering creature or creatures; if there are fewer creatures than lasers, the lasers prioritize Striking the triggering creature or creatures multiple times. Melee laser +16, Damage 2d10+7 fire; no multiple attack penalty"
  },
  {
    "id": "aon-hazards--49-micrometeor-shower",
    "name": "Micrometeor Shower",
    "level": 3,
    "complexity": "complex",
    "type": "environmental",
    "traits": [
      "Environmental"
    ],
    "source": "Guilt of the Grave World",
    "description": "Pebbles and boulders broken off from Barrow's crust accelerate all around the space between the Fracture and the surface, smashing into anything and",
    "stealth": "DC 20 (trained)",
    "stealthDC": 20,
    "disable": "DC 20 Acrobatics to avoid impact, DC 23 Athletics or Strike (AC 20) to break or deflect incoming debris",
    "saves": {},
    "actions": [
      {
        "name": "Impact",
        "actionType": "reaction",
        "trigger": "A creature fails its check to disable or avoid the hazard",
        "effect": "Micrometeors slam into the target, dealing 2d10+13 bludgeoning damage and potentially knocking them off course based on a DC 21 Reflex save."
      }
    ],
    "rawText": " Micrometeor Shower Source Guilt of the Grave World pg. 76 Complexity Complex Pebbles and boulders broken off from Barrow's crust accelerate all around the space between the Fracture and the surface, smashing into anything and everything! --- Stealth DC 20 (trained) Disable DC 20 Acrobatics to avoid impact, DC 23 Athletics or Strike (AC 20) to break or deflect incoming debris Impact Reaction Trigger A creature fails its check to disable or avoid the hazard; Effect Micrometeors slam into the target, dealing 2d10+13 bludgeoning damage and potentially knocking them off course based on a DC 21 Reflex save. Critical Success The creature takes no damage. Success The creature takes half damage. Failure The creature takes full damage and gains the untethered condition, which persists until the start of the next encounter. Critical Failure As failure, but the creature takes double damage.\n"
  },
  {
    "id": "aon-hazards--45-mortar-shells",
    "name": "Mortar Shells",
    "level": 3,
    "complexity": "complex",
    "type": "trap",
    "traits": [
      "Mechanical",
      "Trap"
    ],
    "source": "Guilt of the Grave World",
    "description": "Four mortar tubes are constantly being autoloaded by robotic arms before swiveling to launch projectiles onto the nearby battlefield.",
    "stealth": "DC 17 (trained)",
    "stealthDC": 17,
    "disable": "DC 16 Warfare Lore to engage the mortar safety switches, DC 18 Thievery to jam the auto-loading mechanisms so no more ammunition can be cycled, or DC 20 Athletics to push the tubes out of alignment such that the projectiles no longer threaten the battlefield",
    "reset": "The hazard resets automatically. Any time a PC leaves the trenches, they're targeted by Exploding Ordinance until the mortar shells hazard is disabled.",
    "ac": 17,
    "saves": {
      "fortitude": 12,
      "reflex": 6
    },
    "hp": 40,
    "bt": 20,
    "immunities": [
      "critical hits",
      "object immunities",
      "precision damage"
    ],
    "actions": [
      {
        "name": "Exploding Ordinance",
        "actionType": "reaction",
        "trigger": "A creature fails its check to disable the mortar shells hazard",
        "effect": "A mortar shell explodes, dealing 2d10 fire damage in a 10-foot burst centered on a corner of the triggering creature's square with a DC 18 basic Reflex save."
      }
    ],
    "rawText": " Mortar Shells Source Guilt of the Grave World pg. 54 Complexity Complex Four mortar tubes are constantly being autoloaded by robotic arms before swiveling to launch projectiles onto the nearby battlefield. --- Stealth DC 17 (trained) Disable DC 16 Warfare Lore to engage the mortar safety switches, DC 18 Thievery to jam the auto-loading mechanisms so no more ammunition can be cycled, or DC 20 Athletics to push the tubes out of alignment such that the projectiles no longer threaten the battlefield AC 17, Fort +12, Ref +6 Mortar Tube Hardness 10 Mortar Tube HP 40 (BT 20) Immunities critical hits, object immunities, precision damage Exploding Ordinance Reaction Trigger A creature fails its check to disable the mortar shells hazard; Effect A mortar shell explodes, dealing 2d10 fire damage in a 10-foot burst centered on a corner of the triggering creature's square with a DC 18 basic Reflex save. --- Reset The hazard resets automatically. Any time a PC leaves the trenches, they're targeted by Exploding Ordinance until the mortar shells hazard is disabled."
  },
  {
    "id": "aon-hazards--50-necroturrets",
    "name": "Necroturrets",
    "level": 3,
    "complexity": "complex",
    "type": "trap",
    "traits": [
      "Magical",
      "Mechanical",
      "Tech",
      "Trap"
    ],
    "source": "Guilt of the Grave World",
    "description": "A gigantic spinal column, ripped whole from a great beast, is posed on the surface of Barrow, enhanced with necromantic technology that turns it into",
    "stealth": "+13 (trained)",
    "stealthDC": 13,
    "disable": "DC 16 Computers (trained) or Vidgame Lore (trained) to shut down the necroturret's tech targeting system, DC 18 Arcana (trained), Nature (trained), Occultism (trained), or Religion (trained) to disrupt the necroturret's magical core, or DC 20 Athletics or Thievery to destroy vital circuits. A necroturret loses one action from its routine for each successful check made to disable it, or two actions on a critical success.",
    "reset": "A necroturret deactivates when it no longer detects living creatures within 120 feet of its location.",
    "ac": 16,
    "saves": {
      "fortitude": 14,
      "reflex": 6
    },
    "hardness": 10,
    "hp": 42,
    "bt": 21,
    "immunities": [
      "critical hits",
      "object immunities",
      "precision damage"
    ],
    "actions": [
      {
        "name": "Lock On",
        "actionType": "reaction",
        "trigger": "A living creature moves into a space within 120 feet of the necroturret",
        "effect": "The necroturret locks on to the closest living creature, granting the necroturret a +1 circumstance bonus to its next attack roll. All living creatures within 10 feet of a necroturret take 1d10+6 cold damage with a DC 20 basic Fortitude save as the turret charges its capacitors. The necroturrets then roll for initiative."
      }
    ],
    "routine": "The necroturret uses its actions to attack living creatures with its ice beams. It uses the Lock On reaction once every round to enhance its targeting matrix against the closest living creature. Necroturrets focus on targets trying to disable them.",
    "actionsPerRound": 2,
    "rawText": " Necroturrets Source Guilt of the Grave World pg. 76 Complexity Complex A gigantic spinal column, ripped whole from a great beast, is posed on the surface of Barrow, enhanced with necromantic technology that turns it into a unliving weapons system. Its skull has been replaced with sensor arrays and deadly ice beam emitters. --- Stealth +13 (trained) Disable DC 16 Computers (trained) or Vidgame Lore (trained) to shut down the necroturret's tech targeting system, DC 18 Arcana (trained), Nature (trained), Occultism (trained), or Religion (trained) to disrupt the necroturret's magical core, or DC 20 Athletics or Thievery to destroy vital circuits. A necroturret loses one action from its routine for each successful check made to disable it, or two actions on a critical success. AC 16, Fort +14, Ref +6 Hardness 10 HP 42 (BT 21) Immunities critical hits, object immunities, precision damage Lock On Reaction Trigger A living creature moves into a space within 120 feet of the necroturret; Effect The necroturret locks on to the closest living creature, granting the necroturret a +1 circumstance bonus to its next attack roll. All living creatures within 10 feet of a necroturret take 1d10+6 cold damage with a DC 20 basic Fortitude save as the turret charges its capacitors. The necroturrets then roll for initiative. --- Routine (2 actions) The necroturret uses its actions to attack living creatures with its ice beams. It uses the Lock On reaction once every round to enhance its targeting matrix against the closest living creature. Necroturrets focus on targets trying to disable them. Ranged ice beam +12 (range increment 60 feet, volley 10 feet), Damage 1d10 cold and suppressed for 1 round (2 rounds on a critical hit) --- Reset A necroturret deactivates when it no longer detects living creatures within 120 feet of its location."
  },
  {
    "id": "aon-hazards--46-plot-twist",
    "name": "Plot Twist",
    "level": 3,
    "complexity": "complex",
    "type": "trap",
    "traits": [
      "Mechanical",
      "Trap"
    ],
    "source": "Guilt of the Grave World",
    "description": "An ominous ticking and colorful exposed wires hint at the bomb rigged to the shuttle’s cockpit.",
    "stealth": "DC 18 (trained)",
    "stealthDC": 18,
    "disable": "DC 16 Thievery to cut the trigger wire, DC 18 Athletics to rip the bomb out of the console and hurl it away from the craft before it explodes, or a Strike against AC 20 to destroy the ignition source before it sets off the explosive charges",
    "saves": {},
    "actions": [
      {
        "name": "Boom!",
        "actionType": "reaction",
        "trigger": "Someone starts the shuttle engine, or no creatures succeed at their checks to disable the bomb",
        "effect": "The bomb explodes. All creatures within 30 feet take 6d6 fire damage with a DC 20 basic Reflex save."
      }
    ],
    "rawText": " Plot Twist Source Guilt of the Grave World pg. 56 Complexity Complex An ominous ticking and colorful exposed wires hint at the bomb rigged to the shuttle’s cockpit. --- Stealth DC 18 (trained) Disable DC 16 Thievery to cut the trigger wire, DC 18 Athletics to rip the bomb out of the console and hurl it away from the craft before it explodes, or a Strike against AC 20 to destroy the ignition source before it sets off the explosive charges Boom! Reaction Trigger Someone starts the shuttle engine, or no creatures succeed at their checks to disable the bomb; Effect The bomb explodes. All creatures within 30 feet take 6d6 fire damage with a DC 20 basic Reflex save."
  },
  {
    "id": "aon-hazards--44-soufflé-suprise",
    "name": "Soufflé  Suprise",
    "level": 3,
    "complexity": "complex",
    "type": "trap",
    "traits": [
      "Fire",
      "Magical",
      "Rare"
    ],
    "source": "Guilt of the Grave World",
    "description": "A misshapen blob of pastry and magic wobbles as it keeps rising beyond normal baked good dimensions.",
    "stealth": "+17 (trained)",
    "stealthDC": 17,
    "disable": "DC 18 Cooking Lore (trained), Survival (trained), or Thievery (trained) to gently deflate the soufflé, or DC 23 Athletics to beat the soufflé into submission",
    "ac": 16,
    "saves": {
      "fortitude": 12,
      "reflex": 6
    },
    "hp": 20,
    "immunities": [
      "object immunities (except nonlethal attacks)",
      "precision damage"
    ],
    "actions": [
      {
        "name": "Sudden Rise",
        "actionType": "reaction",
        "trigger": "Zo!'s sabotage begins",
        "effect": "All creatures adjacent to a cooking station take 2d6 fire damage with a DC 23 basic Reflex save. On a critical failure, the creature is also suppressed."
      }
    ],
    "rawText": " Soufflé Suprise Source Guilt of the Grave World pg. 49 Complexity Complex A misshapen blob of pastry and magic wobbles as it keeps rising beyond normal baked good dimensions. --- Stealth +17 (trained) Disable DC 18 Cooking Lore (trained), Survival (trained), or Thievery (trained) to gently deflate the soufflé, or DC 23 Athletics to beat the soufflé into submission AC 16, Fort +12, Ref +6 Soufflé HP 20 Immunities object immunities (except nonlethal attacks), precision damage Sudden Rise Reaction Trigger Zo!'s sabotage begins; Effect All creatures adjacent to a cooking station take 2d6 fire damage with a DC 23 basic Reflex save. On a critical failure, the creature is also suppressed."
  },
  {
    "id": "aon-hazards--27-deadly-vidgame",
    "name": "Deadly Vidgame",
    "level": 4,
    "complexity": "complex",
    "type": "trap",
    "traits": [
      "Tech",
      "Trap"
    ],
    "source": "GM Core",
    "description": "A hyperrealistic vidgame pulls players into a virtual world, transforming them into pixelated avatars and pitting them against deadly challenges.",
    "stealth": "15 (expert)",
    "stealthDC": 15,
    "disable": "DC 22 Computers (trained) to reprogram the game, or DC 22 Thievery (trained) to exploit a glitch, or DC 17 Vidgame Lore (trained) to beat the game; four total successes are required to disable the trap",
    "reset": "The trap resets after 1 hour.",
    "saves": {},
    "actions": [
      {
        "name": "New Game",
        "actionType": "reaction",
        "trigger": "A creature begins to play the vidgame",
        "effect": "The trap attempts to pull all players into the vidgame. Each player must attempt a DC 25 Will save. The trap then rolls initiative."
      }
    ],
    "routine": "The trap presents the game's players with deadly challenges as 1 action. Each creature inside the game takes 2d8+5 slashing damage (DC 21 basic Reflex save). A creature can attempt a Vidgame Lore check in place of their saving throw, if desired.",
    "actionsPerRound": 1,
    "rawText": " Deadly Vidgame Source GM Core pg. 109 Complexity Complex A hyperrealistic vidgame pulls players into a virtual world, transforming them into pixelated avatars and pitting them against deadly challenges. --- Stealth 15 (expert) Disable DC 22 Computers (trained) to reprogram the game, or DC 22 Thievery (trained) to exploit a glitch, or DC 17 Vidgame Lore (trained) to beat the game; four total successes are required to disable the trap New Game Reaction Trigger A creature begins to play the vidgame; Effect The trap attempts to pull all players into the vidgame. Each player must attempt a DC 25 Will save. The trap then rolls initiative. Critical Success The creature is unaffected and can play the game from the safety of reality. Success The creature is pulled into the game for 1 round, then immediately escapes the game, returning to reality. Failure The creature is pulled into the game and can't escape the game until the trap is disabled. Critical Failure The creature is pulled into the game and can't escape the game until the trap is disabled. Unfortunately, it's playing on hard mode, and it treats the DC of the trap's routine as 2 higher. --- Routine (1 action) The trap presents the game's players with deadly challenges as 1 action. Each creature inside the game takes 2d8+5 slashing damage (DC 21 basic Reflex save). A creature can attempt a Vidgame Lore check in place of their saving throw, if desired. Auto-Save If the vidgame console is turned off, all creatures inside the vidgame remain inside the vidgame and are temporarily removed from reality. If the vidgame console is turned back on, these creatures continue the game where they left off. --- Reset The trap resets after 1 hour."
  },
  {
    "id": "aon-hazards--47-exploding-panels",
    "name": "Exploding Panels",
    "level": 4,
    "complexity": "complex",
    "type": "trap",
    "traits": [
      "Tech",
      "Trap"
    ],
    "source": "Guilt of the Grave World",
    "description": "Electricity sparks from panels on the bridge. Wires leap out from access hatches in the corridors like wriggling snakes. The bridge is falling apart",
    "stealth": "+12 (trained)",
    "stealthDC": 12,
    "disable": "DC 17 Computers (trained) to reboot the system; DC 19 Crafting, Physical Science Lore, or Thievery (all trained) to flip circuit breakers and snip the correct wires; DC 21 Acrobatics, Perception, or a Reflex save to dodge the sparks; or DC 24 Athletics or a Fortitude save to force the sparking panels closed. Disabling the trap removes one action from its routine for each successful check to disable it, or two actions on a critical success.",
    "reset": "The exploding panels deactivate after 1 minute.",
    "saves": {},
    "attackBonus": 14,
    "damage": "2d8+5 bludgeoning",
    "actions": [
      {
        "name": "Cascading Failure",
        "actionType": "reaction",
        "trigger": "The encounter begins",
        "effect": "Panels explode all over the ship with sparking live wires. All creatures on the ship take 2d8+5 electricity damage with a DC 21 basic Reflex save. The exploding panels then rolls for initiative."
      }
    ],
    "routine": "The exploding panels trap uses its actions to attack creatures inside the ship. It randomly slashes at creatures adjacent to bulkheads or sparks at creatures within 20 feet of any control surface. The trap does not take a multiple attack penalty.",
    "actionsPerRound": 3,
    "rawText": " Exploding Panels Source Guilt of the Grave World pg. 62 Complexity Complex Electricity sparks from panels on the bridge. Wires leap out from access hatches in the corridors like wriggling snakes. The bridge is falling apart while Captain Concierge cheerfully offers helpful suggestions or how to fix the problem. --- Stealth +12 (trained) Disable DC 17 Computers (trained) to reboot the system; DC 19 Crafting, Physical Science Lore, or Thievery (all trained) to flip circuit breakers and snip the correct wires; DC 21 Acrobatics, Perception, or a Reflex save to dodge the sparks; or DC 24 Athletics or a Fortitude save to force the sparking panels closed. Disabling the trap removes one action from its routine for each successful check to disable it, or two actions on a critical success. Cascading Failure Reaction Trigger The encounter begins; Effect Panels explode all over the ship with sparking live wires. All creatures on the ship take 2d8+5 electricity damage with a DC 21 basic Reflex save. The exploding panels then rolls for initiative. --- Routine (3 actions) The exploding panels trap uses its actions to attack creatures inside the ship. It randomly slashes at creatures adjacent to bulkheads or sparks at creatures within 20 feet of any control surface. The trap does not take a multiple attack penalty. Melee falling panel +14, Damage 2d8+5 bludgeoning Ranged spark +14 (range increment 20 feet), Damage 2d8 electricity --- Reset The exploding panels deactivate after 1 minute."
  },
  {
    "id": "aon-hazards--12-jolting-console",
    "name": "Jolting Console",
    "level": 4,
    "complexity": "complex",
    "type": "trap",
    "traits": [
      "Electricity",
      "Tech",
      "Trap"
    ],
    "source": "GM Core",
    "description": "A shock grid built into a computer console or door panel releases a powerful electric charge.",
    "stealth": "22 (trained)",
    "stealthDC": 22,
    "disable": "DC 16 Computers (trained) to disable the console's programming, or DC 17 Crafting (trained) to rewire the shock grid, or DC 18 Thievery (trained) to deactivate the shock grid",
    "saves": {},
    "actions": [
      {
        "name": "Jolt",
        "actionType": "reaction",
        "effect": "(electricity) **Trigger** A creature grasps the console directly or with a tool; **Effect** The trap deals 5d8 electricity damage to the triggering creature and creatures within 5 feet of the triggering creature (DC 25 basic Reflex save)."
      }
    ],
    "rawText": " Jolting Console Source GM Core pg. 106 Complexity Complex A shock grid built into a computer console or door panel releases a powerful electric charge. --- Stealth 22 (trained) Disable DC 16 Computers (trained) to disable the console's programming, or DC 17 Crafting (trained) to rewire the shock grid, or DC 18 Thievery (trained) to deactivate the shock grid Jolt Reaction (electricity) Trigger A creature grasps the console directly or with a tool; Effect The trap deals 5d8 electricity damage to the triggering creature and creatures within 5 feet of the triggering creature (DC 25 basic Reflex save)."
  },
  {
    "id": "aon-hazards--18-psychotropic-spores",
    "name": "Psychotropic Spores",
    "level": 4,
    "complexity": "complex",
    "type": "environmental",
    "traits": [
      "Environmental"
    ],
    "source": "GM Core",
    "description": "A colorful fungus releases psychotropic spores when a creature comes near.",
    "stealth": "25 (trained)",
    "stealthDC": 25,
    "disable": "DC 20 Nature (trained) to force the fungus into a dormant state, or DC 22 Survival (trained) to safely remove the fungus",
    "reset": "Dormant fungus reactivates in 1 hour; destroyed fungus regrows over the course of 2 weeks.",
    "ac": 18,
    "saves": {
      "fortitude": 12,
      "reflex": 8
    },
    "hp": 60,
    "bt": 30,
    "immunities": [
      "mental"
    ],
    "actions": [
      {
        "name": "Release Spores",
        "actionType": "reaction",
        "effect": "(mental, poison) **Trigger** A creatures touches or damages the fungus; **Effect** The fungus releases psychotropic spores in a 30-foot emanation. All creatures in the area must succeed at a DC 21 Will save or be confused for 1 round and stupefied 1 for 10 minutes (stupefied 2 on a critical failure)."
      }
    ],
    "rawText": " Psychotropic Spores Source GM Core pg. 107 Complexity Complex A colorful fungus releases psychotropic spores when a creature comes near. --- Stealth 25 (trained) Disable DC 20 Nature (trained) to force the fungus into a dormant state, or DC 22 Survival (trained) to safely remove the fungus Mind-Numbing Spores (aura, poison) 5 feet. Creatures in the aura take a –2 circumstance penalty to saves against poison. AC 18, Fort +12, Ref +8 HP 60 (BT 30) Immunities mental Release Spores Reaction (mental, poison) Trigger A creatures touches or damages the fungus; Effect The fungus releases psychotropic spores in a 30-foot emanation. All creatures in the area must succeed at a DC 21 Will save or be confused for 1 round and stupefied 1 for 10 minutes (stupefied 2 on a critical failure). --- Reset Dormant fungus reactivates in 1 hour; destroyed fungus regrows over the course of 2 weeks."
  },
  {
    "id": "aon-hazards--51-shock-grid",
    "name": "Shock Grid",
    "level": 4,
    "complexity": "complex",
    "type": "trap",
    "traits": [
      "Mechanical",
      "Trap"
    ],
    "source": "Guilt of the Grave World",
    "description": "A tight grid of ionized particles crisscrosses the door into the computer center, hissing audibly and glowing bright blue.",
    "stealth": "DC 17 (trained)",
    "stealthDC": 17,
    "disable": "DC 19 Computers or Physical Science Lore to disable the shock grid through the keypad, or DC 21 Crafting or Thievery to short-circuit the wires along the grid's perimeter",
    "reset": "The trap resets automatically until disabled or until it can no longer detect any living creatures within 10 feet of the door outside in area",
    "ac": 18,
    "saves": {
      "fortitude": 14,
      "reflex": 8
    },
    "hardness": 11,
    "hp": 46,
    "bt": 23,
    "immunities": [
      "critical hits",
      "object immunities",
      "precision damage"
    ],
    "actions": [
      {
        "name": "Shocking!",
        "actionType": "reaction",
        "trigger": "A living creature fails their check to disable the shock grid or walks through the shock grid",
        "effect": "The triggering creature takes 4d8+10 electricity damage with a DC 21 basic Fortitude save."
      }
    ],
    "rawText": " Shock Grid Source Guilt of the Grave World pg. 84 Complexity Complex A tight grid of ionized particles crisscrosses the door into the computer center, hissing audibly and glowing bright blue. --- Stealth DC 17 (trained) Disable DC 19 Computers or Physical Science Lore to disable the shock grid through the keypad, or DC 21 Crafting or Thievery to short-circuit the wires along the grid's perimeter AC 18, Fort +14, Ref +8 Hardness 11 HP 46 (BT 23) Immunities critical hits, object immunities, precision damage Shocking! Reaction Trigger A living creature fails their check to disable the shock grid or walks through the shock grid; Effect The triggering creature takes 4d8+10 electricity damage with a DC 21 basic Fortitude save. --- Reset The trap resets automatically until disabled or until it can no longer detect any living creatures within 10 feet of the door outside in area"
  },
  {
    "id": "aon-hazards--37-sentry-turret",
    "name": "Sentry Turret",
    "level": 5,
    "complexity": "complex",
    "type": "trap",
    "traits": [
      "Mechanical",
      "Trap"
    ],
    "source": "GM Core",
    "description": "A mechanized turret attacks intruders.",
    "stealth": "13 (trained)",
    "stealthDC": 13,
    "disable": "DC 20 Computers (trained) to reprogram the turret, or DC 19 Crafting (trained) to cut power to the turret, or DC 18 Thievery (trained) to disable the turret",
    "reset": "The trap resets after 1 minute.",
    "ac": 19,
    "saves": {
      "fortitude": 15,
      "reflex": 9
    },
    "hardness": 12,
    "hp": 54,
    "bt": 26,
    "immunities": [
      "critical hits",
      "object immunities",
      "precision damage"
    ],
    "actions": [
      {
        "name": "Open Fire",
        "actionType": "reaction",
        "trigger": "A creature moves within 30 feet of the turret or attacks the turret",
        "effect": "The turret makes a ranged Strike against the triggering creature; the trap then rolls initiative."
      }
    ],
    "routine": "The trap makes three oversized machine gun Strikes against a creature in range, or the trap makes an Auto-Fire attack followed by one Strike against a creature in range.",
    "actionsPerRound": 3,
    "rawText": " Sentry Turret Source GM Core pg. 112 Complexity Complex A mechanized turret attacks intruders. --- Stealth 13 (trained) Disable DC 20 Computers (trained) to reprogram the turret, or DC 19 Crafting (trained) to cut power to the turret, or DC 18 Thievery (trained) to disable the turret AC 19, Fort +15, Ref +9 Hardness 12 HP 54 (BT 26) Immunities critical hits, object immunities, precision damage Open Fire Reaction Trigger A creature moves within 30 feet of the turret or attacks the turret; Effect The turret makes a ranged Strike against the triggering creature; the trap then rolls initiative. --- Routine (3 actions) The trap makes three oversized machine gun Strikes against a creature in range, or the trap makes an Auto-Fire attack followed by one Strike against a creature in range. Ranged oversized machine gun +15 (analog, automatic, range increment 90 feet), Damage 2d8+7 piercing Auto-Fire oversized machine gun (analog, 45-foot cone), Damage 2d8+7 piercing (DC 22 basic Reflex save) --- Reset The trap resets after 1 minute."
  },
  {
    "id": "aon-hazards--11-haywire-robotic-arm",
    "name": "Haywire Robotic Arm",
    "level": 6,
    "complexity": "complex",
    "type": "trap",
    "traits": [
      "Mechanical",
      "Tech",
      "Trap"
    ],
    "source": "GM Core",
    "description": "A robotic manufacturing arm malfunctions, attacking nearby creatures.",
    "stealth": "18",
    "stealthDC": 18,
    "disable": "DC 20 Computers (trained) to debug the malfunctioning arm, or DC 25 Crafting (trained) to cause the arm's joints to seize, or DC 23 Thievery (trained) to disable the arm",
    "ac": 24,
    "saves": {
      "fortitude": 11,
      "reflex": 17
    },
    "hardness": 12,
    "hp": 58,
    "bt": 29,
    "immunities": [
      "critical hits",
      "object immunities",
      "precision damage"
    ],
    "attackBonus": 20,
    "damage": "4d6+15 bludgeoning plus Grab",
    "actions": [
      {
        "name": "Manufacture",
        "actionType": "reaction",
        "trigger": "A creature moves within reach of the robotic arm",
        "effect": "The trap makes an arm Strike against the triggering creature, then Grabs (+17 Athletics). A creature grabbed by the trap takes 1d6 persistent bludgeoning damage until they Escape (DC 27) or the trap is deactivated or destroyed."
      }
    ],
    "rawText": " Haywire Robotic Arm Source GM Core pg. 106 Complexity Complex A robotic manufacturing arm malfunctions, attacking nearby creatures. --- Stealth 18 Disable DC 20 Computers (trained) to debug the malfunctioning arm, or DC 25 Crafting (trained) to cause the arm's joints to seize, or DC 23 Thievery (trained) to disable the arm AC 24, Fort +11, Ref +17 Hardness 12 HP 58 (BT 29) Immunities critical hits, object immunities, precision damage Manufacture Reaction Trigger A creature moves within reach of the robotic arm; Effect The trap makes an arm Strike against the triggering creature, then Grabs (+17 Athletics). A creature grabbed by the trap takes 1d6 persistent bludgeoning damage until they Escape (DC 27) or the trap is deactivated or destroyed. Melee arm +20 (reach 10 feet), Damage 4d6+15 bludgeoning plus Grab"
  },
  {
    "id": "aon-hazards--39-trash-compactor",
    "name": "Trash Compactor",
    "level": 6,
    "complexity": "complex",
    "type": "trap",
    "traits": [
      "Mechanical",
      "Trap"
    ],
    "source": "GM Core",
    "description": "When activated, the automated trash compactor slowly crushes everything inside it.",
    "stealth": "21 (trained)",
    "stealthDC": 21,
    "disable": "DC 26 Crafting (expert) to jam the crushing mechanism, or DC 24 Thievery (expert) to deactivate the trap; DC 28 Athletics (trained) to Force Open the door (this doesn't disable the trap)",
    "reset": "The trap deactivates and resets after 1 minute.",
    "ac": 21,
    "saves": {
      "fortitude": 17,
      "reflex": 11
    },
    "hp": 54,
    "bt": 27,
    "immunities": [
      "critical hits",
      "object immunities",
      "precision damage"
    ],
    "actions": [
      {
        "name": "Commence Crushing",
        "actionType": "reaction",
        "trigger": "Two or more creatures end their turn in the room",
        "effect": "The doors slam shut, sealing the room. The trap then rolls initiative."
      }
    ],
    "routine": "Two of the room's walls move 5 feet toward the center of the room, automatically pushing any creatures in those spaces 5 feet closer to the room's center and dealing 2d8+9 bludgeoning damage to all creatures in the room (DC 24 basic Fortitude save). Creatures that die from this damage are crushed to a fine paste.",
    "actionsPerRound": 1,
    "rawText": " Trash Compactor Source GM Core pg. 112 Complexity Complex When activated, the automated trash compactor slowly crushes everything inside it. --- Stealth 21 (trained) Disable DC 26 Crafting (expert) to jam the crushing mechanism, or DC 24 Thievery (expert) to deactivate the trap; DC 28 Athletics (trained) to Force Open the door (this doesn't disable the trap) AC 21, Fort +17, Ref +11 Door Hardness 12 HP 54 (BT 27) Immunities critical hits, object immunities, precision damage Commence Crushing Reaction Trigger Two or more creatures end their turn in the room; Effect The doors slam shut, sealing the room. The trap then rolls initiative. --- Routine (1 action) Two of the room's walls move 5 feet toward the center of the room, automatically pushing any creatures in those spaces 5 feet closer to the room's center and dealing 2d8+9 bludgeoning damage to all creatures in the room (DC 24 basic Fortitude save). Creatures that die from this damage are crushed to a fine paste. --- Reset The trap deactivates and resets after 1 minute."
  },
  {
    "id": "aon-hazards--22-traumatic-moment",
    "name": "Traumatic Moment",
    "level": 6,
    "complexity": "complex",
    "type": "haunt",
    "traits": [
      "Haunt"
    ],
    "source": "GM Core",
    "description": "A psychic imprint of a horrific event replays in vivid detail.",
    "stealth": "21 (expert)",
    "stealthDC": 21,
    "disable": "DC 28 Occultism (expert) or Religion (expert) to cleanse the area",
    "saves": {},
    "actions": [
      {
        "name": "Jump Scare",
        "actionType": "reaction",
        "effect": "(emotion, fear, illusion, mental, occult) **Trigger** A creature moves within 10 feet of the haunted area; **Effect** The haunt replays the traumatic moment that created it, vividly assaulting the creature's senses as though the creature was experiencing the event. The creature must attempt a DC 24 Will save."
      }
    ],
    "rawText": " Traumatic Moment Source GM Core pg. 108 Complexity Complex A psychic imprint of a horrific event replays in vivid detail. --- Stealth 21 (expert) Disable DC 28 Occultism (expert) or Religion (expert) to cleanse the area Jump Scare Reaction (emotion, fear, illusion, mental, occult) Trigger A creature moves within 10 feet of the haunted area; Effect The haunt replays the traumatic moment that created it, vividly assaulting the creature's senses as though the creature was experiencing the event. The creature must attempt a DC 24 Will save. Critical Success The target is unaffected. Success The target takes 2d8+5 mental damage and becomes frightened 1. Failure The target takes 4d8+10 mental damage and becomes frightened 2. Critical Failure The target takes 8d8+20 mental damage and becomes frightened 3.\n"
  },
  {
    "id": "aon-hazards--10-exploding-egg-sac",
    "name": "Exploding Egg Sac",
    "level": 7,
    "complexity": "complex",
    "type": "environmental",
    "traits": [
      "Environmental"
    ],
    "source": "GM Core",
    "description": "An ovular alien egg sac emerges from the ground or other surface; pulsing, veinlike filaments cover all surfaces in a 30-foot radius around the egg",
    "stealth": "21",
    "stealthDC": 21,
    "disable": "DC 30 Nature (trained) to cause the egg sac to implode, or DC 23 Survival (expert) to safely destroy the filaments in an adjacent square",
    "reset": "If the egg sac survives and hasn't hatched, filaments regrow in 1 day.",
    "ac": 22,
    "saves": {
      "fortitude": 18,
      "reflex": 12
    },
    "hardness": 14,
    "hp": 60,
    "bt": 30,
    "immunities": [
      "mental"
    ],
    "attackBonus": 18,
    "damage": "2d10+9 slashing; no multiple attack penalty",
    "actions": [
      {
        "name": "Explode",
        "actionType": "reaction",
        "trigger": "A creature touches the egg sac or touches a filament",
        "effect": "The trap makes a filament Strike against all creatures within 30 feet of the egg sac, then the egg sac explodes, dealing 2d10+9 acid damage to all creatures within 30 feet (DC 29 basic Reflex save). If the creature within the egg sac is viable, it hatches."
      }
    ],
    "rawText": " Exploding Egg Sac Source GM Core pg. 106 Complexity Complex An ovular alien egg sac emerges from the ground or other surface; pulsing, veinlike filaments cover all surfaces in a 30-foot radius around the egg sac. --- Stealth 21 Disable DC 30 Nature (trained) to cause the egg sac to implode, or DC 23 Survival (expert) to safely destroy the filaments in an adjacent square AC 22, Fort +18, Ref +12 Hardness 14 HP 60 (BT 30) Immunities mental Explode Reaction Trigger A creature touches the egg sac or touches a filament; Effect The trap makes a filament Strike against all creatures within 30 feet of the egg sac, then the egg sac explodes, dealing 2d10+9 acid damage to all creatures within 30 feet (DC 29 basic Reflex save). If the creature within the egg sac is viable, it hatches. Melee filament +18, Damage 2d10+9 slashing; no multiple attack penalty --- Reset If the egg sac survives and hasn't hatched, filaments regrow in 1 day."
  },
  {
    "id": "aon-hazards--36-reality-geyser",
    "name": "Reality Geyser",
    "level": 7,
    "complexity": "complex",
    "type": "environmental",
    "traits": [
      "Environmental",
      "Magical"
    ],
    "source": "GM Core",
    "description": "A tear in reality emits a chaotic churn of energy into the air like a geyser, raining destruction down on an area.",
    "stealth": "17 (expert)",
    "stealthDC": 17,
    "disable": "DC 27 Arcana (expert) to diffuse the magical energy, or DC 25 Nature (expert) to seal the tear, or DC 30 Survival (trained) to coax the earth back together",
    "saves": {},
    "actions": [
      {
        "name": "Tear Reality",
        "actionType": "reaction",
        "trigger": "A creature moves within 30 feet of the dormant tear",
        "effect": "A tear opens in reality, gouging a 5-foot radius hole in the earth. The trap rolls initiative."
      }
    ],
    "routine": "A chaotic churn of energy blasts out of the tear, dealing 2d10+5 acid damage to all creatures in a 30-foot-tall cylinder centered on the tear (DC 25 basic Reflex save). Creatures damaged by this energy are additionally pushed 10 feet into the air (20 feet on a critical failure). This dispersed energy then rains down, dealing 1d10 fire damage to all creatures within 60 feet of the tear (DC 23 basic Fortitude save).",
    "actionsPerRound": 2,
    "rawText": " Reality Geyser Source GM Core pg. 112 Complexity Complex A tear in reality emits a chaotic churn of energy into the air like a geyser, raining destruction down on an area. --- Stealth 17 (expert) Disable DC 27 Arcana (expert) to diffuse the magical energy, or DC 25 Nature (expert) to seal the tear, or DC 30 Survival (trained) to coax the earth back together Tear Reality Reaction Trigger A creature moves within 30 feet of the dormant tear; Effect A tear opens in reality, gouging a 5-foot radius hole in the earth. The trap rolls initiative. --- Routine (2 actions) A chaotic churn of energy blasts out of the tear, dealing 2d10+5 acid damage to all creatures in a 30-foot-tall cylinder centered on the tear (DC 25 basic Reflex save). Creatures damaged by this energy are additionally pushed 10 feet into the air (20 feet on a critical failure). This dispersed energy then rains down, dealing 1d10 fire damage to all creatures within 60 feet of the tear (DC 23 basic Fortitude save)."
  },
  {
    "id": "aon-hazards--28-disintegration-chamber",
    "name": "Disintegration Chamber",
    "level": 8,
    "complexity": "complex",
    "type": "trap",
    "traits": [
      "Mechanical",
      "Tech",
      "Trap"
    ],
    "source": "GM Core",
    "description": "When sensors detect movement in the trapped room, the doors seal shut, and four wall apertures open, releasing disintegrating nanites into the room.",
    "stealth": "+16 (expert) or DC 31 (expert) to notice the control panel",
    "stealthDC": 16,
    "disable": "DC 22 Crafting (trained) or Thievery (trained) on the control panel to deactivate the trap, or DC 24 Computers (trained) to reprogram the control panel",
    "reset": "The trap deactivates and resets after 1 minute.",
    "ac": 27,
    "saves": {
      "fortitude": 19,
      "reflex": 13
    },
    "hp": 60,
    "bt": 30,
    "immunities": [
      "critical hits",
      "object immunities",
      "precision damage"
    ],
    "attackBonus": 20,
    "damage": "1d10+5 acid; no multiple attack penalty",
    "actions": [
      {
        "name": "Nanite Release",
        "actionType": "reaction",
        "trigger": "A creature enters the room or ends its turn in the room",
        "effect": "The trap makes a nanite Strike against the triggering creature, then rolls initiative."
      },
      {
        "name": "Nanite Swarm",
        "actionType": "free",
        "trigger": "A creature within the room ends its turn",
        "effect": "The trap makes a nanite Strike against the triggering creature."
      }
    ],
    "routine": "The trap launches nanites against every creature in the room as 1 action. Because it launches nanites continuously, the trap can also use the Nanite Swarm free action (see below) to launch nanites at each creature during that creature's turn.",
    "actionsPerRound": 1,
    "rawText": " Disintegration Chamber Source GM Core pg. 109 Complexity Complex When sensors detect movement in the trapped room, the doors seal shut, and four wall apertures open, releasing disintegrating nanites into the room. --- Stealth +16 (expert) or DC 31 (expert) to notice the control panel Disable DC 22 Crafting (trained) or Thievery (trained) on the control panel to deactivate the trap, or DC 24 Computers (trained) to reprogram the control panel AC 27, Fort +19, Ref +13 Control Panel Hardness 15 Control Panel HP 60 (BT 30) Immunities critical hits, object immunities, precision damage Nanite Release Reaction Trigger A creature enters the room or ends its turn in the room; Effect The trap makes a nanite Strike against the triggering creature, then rolls initiative. --- Routine (1 action) The trap launches nanites against every creature in the room as 1 action. Because it launches nanites continuously, the trap can also use the Nanite Swarm free action (see below) to launch nanites at each creature during that creature's turn. Ranged nanite +20, Damage 1d10+5 acid; no multiple attack penalty Nanite Swarm Free Action Trigger A creature within the room ends its turn; Effect The trap makes a nanite Strike against the triggering creature. --- Reset The trap deactivates and resets after 1 minute."
  },
  {
    "id": "aon-hazards--25-vision-of-manifold-realities",
    "name": "Vision of Manifold Realities",
    "level": 8,
    "complexity": "complex",
    "type": "trap",
    "traits": [
      "Magical",
      "Mental",
      "Trap"
    ],
    "source": "GM Core",
    "description": "Wisps of reality-warping magic that flit through the room are drawn to intelligent creatures, filling their minds with visions of countless alternate",
    "stealth": "31 (expert) or  detect magic ",
    "stealthDC": 31,
    "disable": "DC 26 Arcana (expert) to banish the visions, or DC 28 Occultism (expert) to exert your will over the visions, or  dispel magic  (4th rank; counteract DC 24) to counteract the visions",
    "reset": "1 day",
    "saves": {},
    "actions": [
      {
        "name": "Glimpse Manifold Realities",
        "actionType": "reaction",
        "effect": "(mental, visual) **Trigger** An intelligent creature enters the area; **Effect** The trap deals 4d8+18 mental damage to all intelligent creatures who can perceive the visions (DC 26 basic Will save). Creatures who critically fail additionally lose themself in the visions, becoming confused for 1d4 rounds."
      }
    ],
    "rawText": " Vision of Manifold Realities Source GM Core pg. 109 Complexity Complex Wisps of reality-warping magic that flit through the room are drawn to intelligent creatures, filling their minds with visions of countless alternate realities. --- Stealth 31 (expert) or detect magic Disable DC 26 Arcana (expert) to banish the visions, or DC 28 Occultism (expert) to exert your will over the visions, or dispel magic (4th rank; counteract DC 24) to counteract the visions Glimpse Manifold Realities Reaction (mental, visual) Trigger An intelligent creature enters the area; Effect The trap deals 4d8+18 mental damage to all intelligent creatures who can perceive the visions (DC 26 basic Will save). Creatures who critically fail additionally lose themself in the visions, becoming confused for 1d4 rounds. --- Reset 1 day"
  },
  {
    "id": "aon-hazards--32-haywire-autopilot",
    "name": "Haywire Autopilot",
    "level": 9,
    "complexity": "complex",
    "type": "trap",
    "traits": [
      "Tech"
    ],
    "source": "GM Core",
    "description": "A hovercar's autopilot goes haywire, causing it to run over nearby creatures.",
    "stealth": "20 (expert)",
    "stealthDC": 20,
    "disable": "DC 26 Computers (expert) to remotely reprogram the autopilot, or DC 24 Piloting or Thievery (expert) to override the autopilot while aboard the car; three total successes are required to disable the trap; DC 23 Acrobatics or Athletics to board the car (boarding doesn't disable the trap)",
    "ac": 28,
    "saves": {
      "fortitude": 15,
      "reflex": 21
    },
    "hardness": 16,
    "hp": 70,
    "bt": 35,
    "immunities": [
      "critical hits",
      "object immunities",
      "precision damage"
    ],
    "actions": [
      {
        "name": "Ram",
        "actionType": "reaction",
        "trigger": "A creature moves within 30 feet of the hovercar",
        "effect": "The hovercar drives 30 feet in a straight line, dealing 2d10+13 bludgeoning damage to all creatures in the area it passes through (DC 32 basic Reflex save). Creatures damaged by the car are additionally knocked prone. The trap then rolls initiative."
      }
    ],
    "routine": "The trap loses 1 action each turn for each successful disable. The hovercar uses 1 action to drive 30 feet in a straight line, three times, changing direction between actions as desired. Creatures in the area the hovercar passes through take 2d10+13 bludgeoning damage (DC 32 basic Reflex save). Creatures damaged by the car are additionally knocked prone.",
    "actionsPerRound": 3,
    "rawText": " Haywire Autopilot Source GM Core pg. 111 Complexity Complex A hovercar's autopilot goes haywire, causing it to run over nearby creatures. --- Stealth 20 (expert) Disable DC 26 Computers (expert) to remotely reprogram the autopilot, or DC 24 Piloting or Thievery (expert) to override the autopilot while aboard the car; three total successes are required to disable the trap; DC 23 Acrobatics or Athletics to board the car (boarding doesn't disable the trap) AC 28, Fort +15, Ref +21 Hardness 16 HP 70 (BT 35) Immunities critical hits, object immunities, precision damage Ram Reaction Trigger A creature moves within 30 feet of the hovercar; Effect The hovercar drives 30 feet in a straight line, dealing 2d10+13 bludgeoning damage to all creatures in the area it passes through (DC 32 basic Reflex save). Creatures damaged by the car are additionally knocked prone. The trap then rolls initiative. --- Routine (3 actions) The trap loses 1 action each turn for each successful disable. The hovercar uses 1 action to drive 30 feet in a straight line, three times, changing direction between actions as desired. Creatures in the area the hovercar passes through take 2d10+13 bludgeoning damage (DC 32 basic Reflex save). Creatures damaged by the car are additionally knocked prone."
  },
  {
    "id": "aon-hazards--15-monument-to-the-devourer",
    "name": "Monument to The Devourer",
    "level": 9,
    "complexity": "complex",
    "type": "haunt",
    "traits": [
      "Haunt"
    ],
    "source": "GM Core",
    "description": "This shrine has long served as an altar for sacrificial rites and foul magic. When non-believers approach the monument, the souls of all those killed",
    "stealth": "10",
    "stealthDC": 10,
    "disable": "DC 33 Deception (master) to pose as a believer and command the monument to still, or DC 30 Religion (expert) to pray to the gods for protection, or DC 30 Occultism (expert) to soothe the trapped spirits; two successes are required to disable it",
    "reset": "1 hour",
    "ac": 28,
    "saves": {
      "fortitude": 21,
      "reflex": 15
    },
    "hardness": 18,
    "hp": 80,
    "bt": 40,
    "immunities": [
      "critical hits",
      "object immunities",
      "precision damage"
    ],
    "actions": [
      {
        "name": "Surge of Trapped Souls",
        "actionType": "reaction",
        "effect": "(void) **Trigger** A living creature moves within 15 feet of the monument; **Effect** The souls of all those killed by this monument surge outward, dealing 4d10+22 void damage to all living creatures within 60 feet of the monument (DC 28 basic Fortitude save). Creatures killed by this haunt have their soul trapped in the monument until the monument is destroyed."
      }
    ],
    "rawText": " Monument to The Devourer Source GM Core pg. 107 Complexity Complex This shrine has long served as an altar for sacrificial rites and foul magic. When non-believers approach the monument, the souls of all those killed here surge out to reap their lives. --- Stealth 10 Disable DC 33 Deception (master) to pose as a believer and command the monument to still, or DC 30 Religion (expert) to pray to the gods for protection, or DC 30 Occultism (expert) to soothe the trapped spirits; two successes are required to disable it AC 28, Fort +21, Ref +15 Hardness 18 HP 80 (BT 40) Immunities critical hits, object immunities, precision damage Weaknesses holy 10, spirit 10, vitality 10 Surge of Trapped Souls Reaction (void) Trigger A living creature moves within 15 feet of the monument; Effect The souls of all those killed by this monument surge outward, dealing 4d10+22 void damage to all living creatures within 60 feet of the monument (DC 28 basic Fortitude save). Creatures killed by this haunt have their soul trapped in the monument until the monument is destroyed. --- Reset 1 hour"
  },
  {
    "id": "aon-hazards--7-cryo-mist",
    "name": "Cryo Mist",
    "level": 10,
    "complexity": "complex",
    "type": "trap",
    "traits": [
      "Tech",
      "Trap"
    ],
    "source": "GM Core",
    "description": "Hidden nozzles in the ceiling release hyper-cold air, potentially freezing intruders in place.",
    "stealth": "35 (master)",
    "stealthDC": 35,
    "disable": "DC 27 Computers (master) to increase the air's temperature to safe levels, or DC 27 Thievery (master) to deactivate the nozzles",
    "reset": "The trap resets after 1 minute.",
    "saves": {},
    "actions": [
      {
        "name": "Freeze!",
        "actionType": "reaction",
        "effect": "(cold, incapacitation) **Trigger** A creature moves below the nozzles; **Effect** The trap sprays cold air on the triggering creature, dealing 4d10+26 cold damage (DC 33 Fortitude save)."
      }
    ],
    "rawText": " Cryo Mist Source GM Core pg. 105 Complexity Complex Hidden nozzles in the ceiling release hyper-cold air, potentially freezing intruders in place. --- Stealth 35 (master) Disable DC 27 Computers (master) to increase the air's temperature to safe levels, or DC 27 Thievery (master) to deactivate the nozzles Freeze! Reaction (cold, incapacitation) Trigger A creature moves below the nozzles; Effect The trap sprays cold air on the triggering creature, dealing 4d10+26 cold damage (DC 33 Fortitude save). Critical Success The creature is unaffected. Success The creature takes half damage and becomes clumsy 1. Failure The creature takes full damage, becomes clumsy 2, and becomes slowed 1 for 1d4 rounds. Critical Failure The creature takes double damage, becomes clumsy 2, and becomes paralyzed for 1 minute. Creatures within 10 feet of the triggering creature take 2d12+13 cold damage (DC 29 basic Fortitude save). --- Reset The trap resets after 1 minute."
  },
  {
    "id": "aon-hazards--19-repulsing-force-field",
    "name": "Repulsing Force Field",
    "level": 11,
    "complexity": "complex",
    "type": "trap",
    "traits": [
      "Magical",
      "Trap"
    ],
    "source": "GM Core",
    "description": "A translucent force field appears to block a creature's path, shunting it and any other creature that attempts to pass it away.",
    "stealth": "33 (expert)",
    "stealthDC": 33,
    "disable": "DC 33 Thievery (expert) to disable the force field, or  dispel magic  (6th rank; counteract DC 29) to counteract the force field",
    "reset": "The force field deactivates and the trap resets after 1 minute.",
    "ac": 31,
    "saves": {
      "fortitude": 24,
      "reflex": 18
    },
    "hp": 80,
    "bt": 40,
    "immunities": [
      "critical hits",
      "object immunities",
      "precision damage"
    ],
    "attackBonus": 28,
    "damage": "6d8+20 force damage plus the target is knocked back 10 feet (20 feet on a critical hit). The force field takes a –2 circumstance penalty to hit if the triggering creature Stepped or was moved by a forced movement effect.",
    "actions": [
      {
        "name": "Forbid Entry",
        "actionType": "reaction",
        "effect": "(arcane) **Trigger** A creature attempts to pass the designated area; **Effect** The force field appears and shunts the creature away, making a Strike against the triggering creature."
      }
    ],
    "rawText": " Repulsing Force Field Source GM Core pg. 107 Complexity Complex A translucent force field appears to block a creature's path, shunting it and any other creature that attempts to pass it away. --- Stealth 33 (expert) Disable DC 33 Thievery (expert) to disable the force field, or dispel magic (6th rank; counteract DC 29) to counteract the force field AC 31, Fort +24, Ref +18 Force Field Hardness 30 Force Field HP 80 (BT 40) Immunities critical hits, object immunities, precision damage Forbid Entry Reaction (arcane) Trigger A creature attempts to pass the designated area; Effect The force field appears and shunts the creature away, making a Strike against the triggering creature. Melee force field +28, Damage 6d8+20 force damage plus the target is knocked back 10 feet (20 feet on a critical hit). The force field takes a –2 circumstance penalty to hit if the triggering creature Stepped or was moved by a forced movement effect. --- Reset The force field deactivates and the trap resets after 1 minute."
  },
  {
    "id": "aon-hazards--16-mutation-fog",
    "name": "Mutation Fog",
    "level": 12,
    "complexity": "complex",
    "type": "environmental",
    "traits": [
      "Environmental"
    ],
    "source": "GM Core",
    "description": "A fog of transmutative fumes fills a 30-foot radius area, painfully mutating creatures who enter.",
    "stealth": "30 (expert)",
    "stealthDC": 30,
    "disable": "DC 35 Nature (master) to neutralize the fog, or DC 35 Survival (master) to disperse the fog",
    "saves": {},
    "actions": [
      {
        "name": "Harmful Mutation",
        "actionType": "reaction",
        "effect": "(polymorph) **Trigger** A creature begins its turn in the fog; **Effect** The fog surges with energy, dealing 6d10+27 bludgeoning damage to all creatures in the fog as it harmfully mutates their bodies. Creatures in the area must attempt a DC 32 Fortitude save."
      }
    ],
    "rawText": " Mutation Fog Source GM Core pg. 107 Complexity Complex A fog of transmutative fumes fills a 30-foot radius area, painfully mutating creatures who enter. --- Stealth 30 (expert) Disable DC 35 Nature (master) to neutralize the fog, or DC 35 Survival (master) to disperse the fog Harmful Mutation Reaction (polymorph) Trigger A creature begins its turn in the fog; Effect The fog surges with energy, dealing 6d10+27 bludgeoning damage to all creatures in the fog as it harmfully mutates their bodies. Creatures in the area must attempt a DC 32 Fortitude save. Critical Success The creature is unaffected. Success The creature takes half damage. It resists mutation. Failure The creature takes full damage. Its flesh becomes coated in foul-smelling blisters for 1 hour. For as long as it has this mutation, it is sickened 1 and can't reduce the value of its sickened condition. Critical Failure The creature takes double damage. Its limbs become painfully twisted for 1d4 hours. For as long as it has this mutation, it is sickened 2 and can't reduce the value of its sickened condition.\n"
  },
  {
    "id": "aon-hazards--21-temporal-rift",
    "name": "Temporal Rift",
    "level": 13,
    "complexity": "complex",
    "type": "trap",
    "traits": [
      "Magical",
      "Trap"
    ],
    "source": "GM Core",
    "description": "A rift in time rapidly ages and slows anyone who draws near.",
    "stealth": "29 (trained)",
    "stealthDC": 29,
    "disable": "DC 36 Arcana (master) or Occultism (master) to magically mend time, DC 40 Thievery (master) to repair the time rift, or  dispel magic  (7th rank; counteract DC 31) to counteract the rift",
    "saves": {},
    "actions": [
      {
        "name": "Time Shudder",
        "actionType": "reaction",
        "effect": "(occult) **Trigger** A creature moves within 10 feet of the rift; **Effect** The triggering creature takes 6d10+20 damage as its body rapidly ages. It must attempt a DC 33 Will save."
      }
    ],
    "rawText": " Temporal Rift Source GM Core pg. 108 Complexity Complex A rift in time rapidly ages and slows anyone who draws near. --- Stealth 29 (trained) Disable DC 36 Arcana (master) or Occultism (master) to magically mend time, DC 40 Thievery (master) to repair the time rift, or dispel magic (7th rank; counteract DC 31) to counteract the rift Time Shudder Reaction (occult) Trigger A creature moves within 10 feet of the rift; Effect The triggering creature takes 6d10+20 damage as its body rapidly ages. It must attempt a DC 33 Will save. Critical Success The creature is unaffected. Success The creature takes half damage and becomes clumsy 1 and enfeebled 1. Failure The creature takes full damage, and becomes clumsy 2 and enfeebled 2. Critical Failure The creature takes double damage, becomes clumsy 2 and enfeebled 2, and becomes slowed for 1 minute.\n"
  },
  {
    "id": "aon-hazards--26-collapsing-building",
    "name": "Collapsing Building",
    "level": 14,
    "complexity": "complex",
    "type": "environmental",
    "traits": [
      "Environmental"
    ],
    "source": "GM Core",
    "description": "A building collapses, harming everyone inside.",
    "stealth": "28 (expert)",
    "stealthDC": 28,
    "disable": "DC 38 Arcana (expert) or Nature (expert) to magically prop up the building, DC 34 Crafting (master) or Survival (master) to stabilize the building, DC 38 Religion (expert) to pray for the collapse to cease; four total successes are required to stop the collapse",
    "saves": {},
    "actions": [
      {
        "name": "Shudder",
        "actionType": "reaction",
        "trigger": "An effect damages the building, or the ground around the building shifts",
        "effect": "The building shudders and creaks, signaling an imminent collapse. The building's interior becomes difficult terrain. The trap rolls initiative."
      }
    ],
    "routine": "The building begins to collapse. All creatures in the building take 3d10+18 bludgeoning damage (DC 39 basic Reflex save). A creature that critically fails its save is additionally knocked prone and takes 1d6 persistent bleed damage.",
    "actionsPerRound": 1,
    "rawText": " Collapsing Building Source GM Core pg. 109 Complexity Complex A building collapses, harming everyone inside. --- Stealth 28 (expert) Disable DC 38 Arcana (expert) or Nature (expert) to magically prop up the building, DC 34 Crafting (master) or Survival (master) to stabilize the building, DC 38 Religion (expert) to pray for the collapse to cease; four total successes are required to stop the collapse Shudder Reaction Trigger An effect damages the building, or the ground around the building shifts; Effect The building shudders and creaks, signaling an imminent collapse. The building's interior becomes difficult terrain. The trap rolls initiative. --- Routine (1 action) The building begins to collapse. All creatures in the building take 3d10+18 bludgeoning damage (DC 39 basic Reflex save). A creature that critically fails its save is additionally knocked prone and takes 1d6 persistent bleed damage."
  },
  {
    "id": "aon-hazards--53-quaking-footfalls",
    "name": "Quaking Footfalls",
    "level": 14,
    "complexity": "complex",
    "type": "environmental",
    "traits": [
      "Environmental",
      "Kaiju"
    ],
    "source": "Alien Core",
    "description": "The footsteps of a kyokor (or other kaiju) shake the ground, causing the earth around it to tremble as though from a powerful earthquake.",
    "stealth": "DC 10",
    "stealthDC": 10,
    "disable": "DC 39 Athletics (trained), Civil Engineering Lore (trained), or Crafting (trained) to brace a small structure or surface to cancel the effects of the quake in that area, DC 41 Arcana (legendary), Occultism (legendary), or Performance (legendary) to calm or divert the kyokor; three total successes are required to disable the hazard; DC 30 Piloting (trained) if in a vehicle to avoid the kyokor's path (disables the hazard only for that vehicle)",
    "saves": {},
    "actions": [
      {
        "name": "Quake",
        "actionType": "reaction",
        "effect": "The kyokor moves at least 60 feet; **Effect** The ground shakes in a 120-foot emanation from the kyokor's space. The ground becomes difficult terrain, and creatures on it are clumsy 2 for 1 round. Ground vehicles move at half speed."
      }
    ],
    "rawText": " Quaking Footfalls Source Alien Core pg. 104 Complexity Complex The footsteps of a kyokor (or other kaiju) shake the ground, causing the earth around it to tremble as though from a powerful earthquake. --- Stealth DC 10 Disable DC 39 Athletics (trained), Civil Engineering Lore (trained), or Crafting (trained) to brace a small structure or surface to cancel the effects of the quake in that area, DC 41 Arcana (legendary), Occultism (legendary), or Performance (legendary) to calm or divert the kyokor; three total successes are required to disable the hazard; DC 30 Piloting (trained) if in a vehicle to avoid the kyokor's path (disables the hazard only for that vehicle) Quake Reaction The kyokor moves at least 60 feet; Effect The ground shakes in a 120-foot emanation from the kyokor's space. The ground becomes difficult terrain, and creatures on it are clumsy 2 for 1 round. Ground vehicles move at half speed. Fissures open above underground spaces (like sewers, sinkholes, or catacombs). Creatures in the area tumble into the resulting 40-foot-deep hole unless they succeed at a DC 40 Reflex save. Near a body of water, these tremors creates dangerous waves. Creatures in the water or within 60 feet of the waterline are struck by waves that deal 3d8 bludgeoning damage (DC 35 basic Reflex save). On a critical failure, a creature is instantly swept 60 feet out to sea and 60 feet under the water's surface."
  },
  {
    "id": "aon-hazards--54-collapsing-structure",
    "name": "Collapsing Structure",
    "level": 15,
    "complexity": "complex",
    "type": "environmental",
    "traits": [
      "Environmental",
      "Kaiju"
    ],
    "source": "Alien Core",
    "description": "The kyokor (or other kaiju) grazes a structure, severely compromising the building's stability and possibly causing it to collapse.",
    "stealth": "+20 (master) to notice cracks forming in the walls of the structure as the kyokor (or another kaiju) approaches.",
    "stealthDC": 20,
    "disable": "DC 43 Athletics (master), Civil Engineering Lore (master), or Crafting (master) check to brace the structure to reduce the risk of collapse until the end of the creature's next turn. The DC of the flat check for this round (see Routine) is increased by 4 on a success, or by 8 on a critical success. Increasing the flat check DC to 21 or higher stabilizes the structure, ending this hazard.",
    "reset": "The building becomes susceptible to Demolish again 1d6 rounds after it's stabilized.",
    "saves": {},
    "actions": [
      {
        "name": "Demolish",
        "actionType": "reaction",
        "effect": "The kyokor (or other kaiju) applies any amount of force to the structure; **Effect** The building trembles. The floors of the building and the streets within 30 feet of the building become difficult terrain; creatures on this difficult terrain take a –2 circumstance penalty to attack rolls, AC, and skill checks. The hazard rolls initiative."
      }
    ],
    "routine": "The GM rolls a DC 9 flat check to determine if the building collapses, increasing the DC as listed in Disable. On a success, dust and debris fall within the building and 30 feet around it, providing concealment and dealing 6d6 bludgeoning damage to 1d4 randomly chosen targets (DC 35 basic Reflex save); on a critical failure, a creature is also knocked prone. On a critical success on the flat check, the effect is the same, but the debris deals 12d6 bludgeoning damage to 2d4 randomly chosen targets instead (DC 35 basic Reflex save); on a critical failure, a creature is knocked prone and restrained by rubble until freed (DC 38 to Force Open; Escape DC 35).",
    "actionsPerRound": 1,
    "rawText": " Collapsing Structure Source Alien Core pg. 104 Complexity Complex The kyokor (or other kaiju) grazes a structure, severely compromising the building's stability and possibly causing it to collapse. --- Stealth +20 (master) to notice cracks forming in the walls of the structure as the kyokor (or another kaiju) approaches. Disable DC 43 Athletics (master), Civil Engineering Lore (master), or Crafting (master) check to brace the structure to reduce the risk of collapse until the end of the creature's next turn. The DC of the flat check for this round (see Routine) is increased by 4 on a success, or by 8 on a critical success. Increasing the flat check DC to 21 or higher stabilizes the structure, ending this hazard. Demolish Reaction The kyokor (or other kaiju) applies any amount of force to the structure; Effect The building trembles. The floors of the building and the streets within 30 feet of the building become difficult terrain; creatures on this difficult terrain take a –2 circumstance penalty to attack rolls, AC, and skill checks. The hazard rolls initiative. --- Routine (1 action) The GM rolls a DC 9 flat check to determine if the building collapses, increasing the DC as listed in Disable. On a success, dust and debris fall within the building and 30 feet around it, providing concealment and dealing 6d6 bludgeoning damage to 1d4 randomly chosen targets (DC 35 basic Reflex save); on a critical failure, a creature is also knocked prone. On a critical success on the flat check, the effect is the same, but the debris deals 12d6 bludgeoning damage to 2d4 randomly chosen targets instead (DC 35 basic Reflex save); on a critical failure, a creature is knocked prone and restrained by rubble until freed (DC 38 to Force Open; Escape DC 35). --- Reset The building becomes susceptible to Demolish again 1d6 rounds after it's stabilized."
  },
  {
    "id": "aon-hazards--20-soul-upload",
    "name": "Soul Upload",
    "level": 15,
    "complexity": "complex",
    "type": "trap",
    "traits": [
      "Magical",
      "Tech",
      "Trap"
    ],
    "source": "GM Core",
    "description": "A computer is protected by a hybrid trap, which uploads the soul of all unauthorized users to an inert data module on the computer.",
    "stealth": "40 (master)",
    "stealthDC": 40,
    "disable": "DC 36 Arcana (expert) to drain the computer's magical energy, or DC 36 Computers (expert) to falsify authorized credentials, or DC 40 Thievery (expert) to disable the trap, or  dispel magic  (7th rank; counteract DC 34) to counteract the trap",
    "saves": {},
    "actions": [
      {
        "name": "Upload Soul",
        "actionType": "reaction",
        "effect": "(incapacitation, occult) **Trigger** An unauthorized creature grasps the computer directly or with a tool; **Effect** The trap attempts to upload the triggering creature's soul into the computer. The triggering creature must attempt a DC 40 Will save."
      }
    ],
    "rawText": " Soul Upload Source GM Core pg. 108 Complexity Complex A computer is protected by a hybrid trap, which uploads the soul of all unauthorized users to an inert data module on the computer. --- Stealth 40 (master) Disable DC 36 Arcana (expert) to drain the computer's magical energy, or DC 36 Computers (expert) to falsify authorized credentials, or DC 40 Thievery (expert) to disable the trap, or dispel magic (7th rank; counteract DC 34) to counteract the trap Upload Soul Reaction (incapacitation, occult) Trigger An unauthorized creature grasps the computer directly or with a tool; Effect The trap attempts to upload the triggering creature's soul into the computer. The triggering creature must attempt a DC 40 Will save. Critical Success The creature is unaffected. Success The creature takes 3d10+15 spirit damage. Failure The creature's soul is temporarily pulled from their body. It takes 6d10+30 spirit damage and is stunned 3. Critical Failure The creature's soul is pulled from its body and uploaded to a data module on the computer. Its body remains a soulless vessel, which slowly dies over the course of 1 week unless its soul is returned. Destroying the computer destroys its soul.\n"
  },
  {
    "id": "aon-hazards--34-quantum-clone",
    "name": "Quantum Clone",
    "level": 16,
    "complexity": "complex",
    "type": "trap",
    "traits": [
      "Magical"
    ],
    "source": "GM Core",
    "description": "Quantum particles form an exact copy of a creature that can mimic its actions, speech, and thoughts with eerie perfection.",
    "stealth": "32 (expert)",
    "stealthDC": 32,
    "disable": "DC 42 Intimidation (master) to frighten the clone away, or DC 42 Diplomacy (master) to reach an accord with the clone, or DC 45 Arcana (master) or Nature (master) to disperse the quantum particles; three total successes are required to disable the trap",
    "saves": {},
    "actions": [
      {
        "name": "Materialize",
        "actionType": "reaction",
        "trigger": "A creature touches the quantum particles",
        "effect": "The quantum particles materialize a perfect copy of the triggering creature. The quantum clone is visually identical to the creature and mimics the creature's actions and speech until it has time to observe and learn the creature's patterns well enough to act entirely on its own, a process that takes 1 minute. The quantum clone materializes with no weapons or equipment but can use unarmed Strikes if the creature has them. The quantum clone rolls initiative."
      },
      {
        "name": "Mimic",
        "actionType": 1,
        "effect": "to"
      }
    ],
    "routine": "The quantum clone observes the triggering creature and mimics the creature's behavior, taking hostile actions as soon as it takes damage. For the first 2 rounds, the quantum clone takes actions in the exact order the triggering creature did, but in the following rounds, it acts tactically, using actions and reactions it observed the creature using in any order.",
    "actionsPerRound": 3,
    "rawText": " Quantum Clone Source GM Core pg. 111 Complexity Complex Quantum particles form an exact copy of a creature that can mimic its actions, speech, and thoughts with eerie perfection. --- Stealth 32 (expert) Disable DC 42 Intimidation (master) to frighten the clone away, or DC 42 Diplomacy (master) to reach an accord with the clone, or DC 45 Arcana (master) or Nature (master) to disperse the quantum particles; three total successes are required to disable the trap Materialize Reaction Trigger A creature touches the quantum particles; Effect The quantum particles materialize a perfect copy of the triggering creature. The quantum clone is visually identical to the creature and mimics the creature's actions and speech until it has time to observe and learn the creature's patterns well enough to act entirely on its own, a process that takes 1 minute. The quantum clone materializes with no weapons or equipment but can use unarmed Strikes if the creature has them. The quantum clone rolls initiative. --- Routine (3 actions) The quantum clone observes the triggering creature and mimics the creature's behavior, taking hostile actions as soon as it takes damage. For the first 2 rounds, the quantum clone takes actions in the exact order the triggering creature did, but in the following rounds, it acts tactically, using actions and reactions it observed the creature using in any order. Mimic Single Action to Three Actions The quantum clone mimics an action it's observed the triggering creature take, including class abilities, movements, spells, and speech. It attacks on its initiative, using the same statistics as the original creature."
  },
  {
    "id": "aon-hazards--8-devastating-collision",
    "name": "Devastating Collision",
    "level": 17,
    "complexity": "complex",
    "type": "haunt",
    "traits": [
      "Haunt"
    ],
    "source": "GM Core",
    "description": "A phantom hover truck collides with creatures, replaying an accident from the past in gory detail.",
    "stealth": "43 (master) to hear the roar of hover jets",
    "stealthDC": 43,
    "disable": "DC 38 Occultism (master) to disperse the phantom truck, or DC 36 Religion (master) to ward yourself from harm",
    "reset": "1 day",
    "saves": {},
    "actions": [
      {
        "name": "Crash",
        "actionType": "reaction",
        "trigger": "A creature crosses the street",
        "effect": "A phantom hover truck crashes into all creatures crossing the street, dealing 6d12+37 bludgeoning damage (DC 43 Fortitude save)."
      }
    ],
    "rawText": " Devastating Collision Source GM Core pg. 105 Complexity Complex A phantom hover truck collides with creatures, replaying an accident from the past in gory detail. --- Stealth 43 (master) to hear the roar of hover jets Disable DC 38 Occultism (master) to disperse the phantom truck, or DC 36 Religion (master) to ward yourself from harm Crash Reaction Trigger A creature crosses the street; Effect A phantom hover truck crashes into all creatures crossing the street, dealing 6d12+37 bludgeoning damage (DC 43 Fortitude save). Critical Success The creature is unaffected. Success The creature takes half damage, is knocked prone, and is pushed 10 feet back. Failure The creature takes full damage, is knocked prone, and is pushed 20 feet back. Critical Failure The creature takes double damage, is knocked prone, and is pushed 30 feet back. --- Reset 1 day"
  },
  {
    "id": "aon-hazards--55-writhing-tentacles",
    "name": "Writhing Tentacles",
    "level": 18,
    "complexity": "complex",
    "type": "environmental",
    "traits": [
      "Environmental",
      "Kaiju"
    ],
    "source": "Alien Core",
    "description": "The kyokor's tentacles snake out, causing devastation.",
    "stealth": "DC 10",
    "stealthDC": 10,
    "disable": "DC 45 Arcana (legendary), Occultism (legendary), or Performance (legendary) to soothe or divert the kyokor's attention; using a guardian orb (see the sidebar) to command the kyokor ends the hazard",
    "reset": "The kyokor's tentacles can't writhe again for 1d4 rounds.",
    "saves": {},
    "actions": [
      {
        "name": "Tentacle Slam",
        "actionType": "reaction",
        "trigger": "A creature takes a hostile action against the kyokor, produces a visible area effect, or flies within 120 feet of the kyokor",
        "effect": "The kyokor deals 6d10+28 bludgeoning damage in a 120-foot line, and each creature in the area must attempt a DC 40 Reflex save."
      }
    ],
    "rawText": " Writhing Tentacles Source Alien Core pg. 105 Complexity Complex The kyokor's tentacles snake out, causing devastation. --- Stealth DC 10 Disable DC 45 Arcana (legendary), Occultism (legendary), or Performance (legendary) to soothe or divert the kyokor's attention; using a guardian orb (see the sidebar) to command the kyokor ends the hazard Tentacle Slam Reaction Trigger A creature takes a hostile action against the kyokor, produces a visible area effect, or flies within 120 feet of the kyokor; Effect The kyokor deals 6d10+28 bludgeoning damage in a 120-foot line, and each creature in the area must attempt a DC 40 Reflex save. Critical Success The creature is unaffected. Success The creature takes half damage and is pushed 20 feet away. If flying, it descends 20 feet. Failure The creature takes full damage, is pushed 40 feet, and descends 60 feet (if flying) or is knocked prone. Critical Failure The creature takes double damage, is pushed 60 feet away, descends 120 feet (if flying) or is knocked prone, and is stunned 2. --- Reset The kyokor's tentacles can't writhe again for 1d4 rounds."
  },
  {
    "id": "aon-hazards--35-reactor-meltdown",
    "name": "Reactor Meltdown",
    "level": 19,
    "complexity": "complex",
    "type": "trap",
    "traits": [
      "Tech",
      "Trap"
    ],
    "source": "GM Core",
    "description": "A nuclear reactor overloads, then explodes.",
    "stealth": "27",
    "stealthDC": 27,
    "disable": "DC 45 Computers (master) or Crafting (master) to initiate shutdown procedures, or DC 47 Thievery (master) to vent the reactor; three total successes are required to disable the trap",
    "saves": {},
    "actions": [
      {
        "name": "Radiation Leak",
        "actionType": "reaction",
        "trigger": "A creature views the reactor's sensors or console",
        "effect": "Creatures within 60 feet of the reactor are exposed to incredible radiation (DC 32 Fortitude). The trap rolls initiative."
      },
      {
        "name": "Nuclear Explosion",
        "actionType": "free",
        "trigger": "The trap completed its routine with a radius of 100 feet",
        "effect": "The reactor explodes, dealing 4d10+20 fire damage in a 500 foot radius, bypassing the hardness of any items in the blast zone (DC 46 basic Fortitude save). Everything in the area is exposed to incredible radiation. The area of the nuclear explosion becomes irradiated, leaking severe radiation for 50 years."
      }
    ],
    "routine": "As the reactor overheats, the trap deals 4d10+20 fire damage to creatures within 60 feet (DC 42 basic Fortitude save). All creatures in the area are exposed to incredible radiation.",
    "actionsPerRound": 1,
    "rawText": " Reactor Meltdown Source GM Core pg. 111 Complexity Complex A nuclear reactor overloads, then explodes. --- Stealth 27 Disable DC 45 Computers (master) or Crafting (master) to initiate shutdown procedures, or DC 47 Thievery (master) to vent the reactor; three total successes are required to disable the trap Radiation Leak Reaction Trigger A creature views the reactor's sensors or console; Effect Creatures within 60 feet of the reactor are exposed to incredible radiation (DC 32 Fortitude). The trap rolls initiative. --- Routine (1 action) As the reactor overheats, the trap deals 4d10+20 fire damage to creatures within 60 feet (DC 42 basic Fortitude save). All creatures in the area are exposed to incredible radiation. Each time the trap uses this routine, the area increases by 10 feet. When the routine's radius equals 100 feet, resolve the routine. Then, the reactor immediately explodes, using Nuclear Explosion. Nuclear Explosion Free Action Trigger The trap completed its routine with a radius of 100 feet; Effect The reactor explodes, dealing 4d10+20 fire damage in a 500 foot radius, bypassing the hardness of any items in the blast zone (DC 46 basic Fortitude save). Everything in the area is exposed to incredible radiation. The area of the nuclear explosion becomes irradiated, leaking severe radiation for 50 years."
  },
  {
    "id": "aon-hazards--14-memory-crystals",
    "name": "Memory Crystals",
    "level": 20,
    "complexity": "complex",
    "type": "environmental",
    "traits": [
      "Environmental",
      "Magical",
      "Mental"
    ],
    "source": "GM Core",
    "description": "Glowing yellow crystals refract the blurred imprints of stolen memories within their facets.",
    "stealth": "38 (expert) or  detect magic ",
    "stealthDC": 38,
    "disable": "DC 48 Arcana (legendary) to erect mental wards, or DC 48 Occultism (legendary) to harmlessly feed surface thoughts to the crystals, or DC 51 Religion (legendary) to pray for protection from the crystals",
    "reset": "After expanding, the memory crystals can't grow again for 1 day.",
    "ac": 42,
    "saves": {
      "fortitude": 36,
      "reflex": 30
    },
    "hardness": 33,
    "hp": 134,
    "bt": 67,
    "immunities": [
      "critical hits",
      "object immunities",
      "precision damage"
    ],
    "actions": [
      {
        "name": "Leech Memories",
        "actionType": "reaction",
        "trigger": "A non-mindless creature comes within 5 feet of the memory crystals",
        "effect": "The memory crystals expand into every square adjacent to their space. As they grow, they absorb memories and ambient thought from their surroundings, dealing 8d10 mental damage (DC 42 basic Will save) to creatures within 10 feet after they expand."
      }
    ],
    "rawText": " Memory Crystals Source GM Core pg. 106 Complexity Complex Glowing yellow crystals refract the blurred imprints of stolen memories within their facets. --- Stealth 38 (expert) or detect magic Disable DC 48 Arcana (legendary) to erect mental wards, or DC 48 Occultism (legendary) to harmlessly feed surface thoughts to the crystals, or DC 51 Religion (legendary) to pray for protection from the crystals AC 42, Fort +36, Ref +30 Hardness 33 HP 134 (BT 67) Immunities critical hits, object immunities, precision damage Leech Memories Reaction Trigger A non-mindless creature comes within 5 feet of the memory crystals; Effect The memory crystals expand into every square adjacent to their space. As they grow, they absorb memories and ambient thought from their surroundings, dealing 8d10 mental damage (DC 42 basic Will save) to creatures within 10 feet after they expand. Memory Field (aura, mental) 5 feet. Memory crystals deal 8d10 mental damage to nearby creatures. --- Reset After expanding, the memory crystals can't grow again for 1 day."
  },
  {
    "id": "aon-hazards--56-terrible-roar",
    "name": "Terrible Roar",
    "level": 20,
    "complexity": "complex",
    "type": "environmental",
    "traits": [
      "Environmental",
      "Kaiju"
    ],
    "source": "Alien Core",
    "description": "The kyokor unleashes a terrible roar.",
    "stealth": "DC 10",
    "stealthDC": 10,
    "disable": "DC 50 Arcana (legendary), Occultism (legendary), or Performance (legendary) to counteract the roar",
    "reset": "The kyokor must wait 1d4 rounds before roaring again.",
    "saves": {},
    "actions": [
      {
        "name": "Thundering Roar",
        "actionType": "reaction",
        "effect": "(sonic) **Trigger** A creature takes a hostile action against the kyokor, produces a visible area effect, or flies within 120 feet of the kyokor; **Effect** The kyokor roars, producing a 120-foot cone of sound in the direction of the triggering creature. Unattended objects of 5 or less Hardness immediately gain the broken condition, and concrete and metal surfaces warp into difficult terrain. Creatures in the area take 20d6 sonic damage (DC 44 basic Fortitude save). On a failure, a creature also takes 3d6 persistent mental damage and is sickened 2."
      }
    ],
    "rawText": " Terrible Roar Source Alien Core pg. 105 Complexity Complex The kyokor unleashes a terrible roar. --- Stealth DC 10 Disable DC 50 Arcana (legendary), Occultism (legendary), or Performance (legendary) to counteract the roar Thundering Roar Reaction (sonic) Trigger A creature takes a hostile action against the kyokor, produces a visible area effect, or flies within 120 feet of the kyokor; Effect The kyokor roars, producing a 120-foot cone of sound in the direction of the triggering creature. Unattended objects of 5 or less Hardness immediately gain the broken condition, and concrete and metal surfaces warp into difficult terrain. Creatures in the area take 20d6 sonic damage (DC 44 basic Fortitude save). On a failure, a creature also takes 3d6 persistent mental damage and is sickened 2. --- Reset The kyokor must wait 1d4 rounds before roaring again."
  }
]